{
  "SCHEMA_VERSION": "1.0.0",
  "CONTENT_ID": "minecraft-adventures-ep01",
  "SERIES": "Minecraft Adventures — เรื่องสั้นผจญภัยจบในตอน",
  "SERIES_ID": "minecraft-adventures",
  "EPISODE": 1,
  "TITLE_TH": "หมาป่าที่หลงทาง",
  "TITLE_EN": "The Lost Wolf",
  "SHORT_DESCRIPTION_TH": "Steve เดินทางกับหมาป่าคู่ใจในทุ่งหญ้า แต่หมาป่าวิ่งตามกระต่ายจนหลงไปอีกฝั่งแม่น้ำ Steve ตามรอยเท้าไปพบมันติดอยู่บนเกาะเล็กใกล้สะพานที่พัง เขาตัดไ...",
  "LONG_DESCRIPTION_TH": "Minecraft Adventures EP01 — หมาป่าที่หลงทาง: Steve เดินทางกับหมาป่าคู่ใจในทุ่งหญ้า แต่หมาป่าวิ่งตามกระต่ายจนหลงไปอีกฝั่งแม่น้ำ Steve ตามรอยเท้าไปพบมันติดอยู่บนเกาะเล็กใกล้สะพานที่พัง เขาตัดไม้ ซ่อมทางข้าม และพาหมาป่ากลับบ้านด้วยกันก่อนพระอาทิตย์ตก เรื่องสั้นแนวตั้ง 9:16 จบในตอน โทนสดใส ไม่มีบทพูด ไม่มีผู้บรรยาย ใช้ดนตรี บรรยากาศ และเสียงเอฟเฟกต์เล่าเรื่อง",
  "HOOK": "หมาป่าหายไปอีกฝั่งแม่น้ำ Steve จะซ่อมสะพานทันเวลากลับบ้านก่อนพระอาทิตย์ตกไหม?",
  "HASHTAGS": [
    "#Minecraft",
    "#MinecraftAdventure",
    "#MinecraftShorts",
    "#GamingShorts",
    "#เรื่องสั้น",
    "#ผจญภัย",
    "#EP01"
  ],
  "KEYWORDS": [
    "Minecraft",
    "Minecraft Adventures",
    "เรื่องสั้น Minecraft",
    "ผจญภัย",
    "family friendly",
    "vertical video",
    "shorts",
    "หมาป่าที่หลงทาง",
    "The Lost Wolf"
  ],
  "TAGS": [
    "Minecraft",
    "Minecraft Adventures",
    "เรื่องสั้น Minecraft",
    "ผจญภัย",
    "family friendly",
    "vertical video",
    "shorts",
    "หมาป่าที่หลงทาง",
    "The Lost Wolf"
  ],
  "PLATFORM_CAPTIONS": {
    "YOUTUBE": "หมาป่าที่หลงทาง\n\nMinecraft Adventures EP01 — หมาป่าที่หลงทาง: Steve เดินทางกับหมาป่าคู่ใจในทุ่งหญ้า แต่หมาป่าวิ่งตามกระต่ายจนหลงไปอีกฝั่งแม่น้ำ Steve ตามรอยเท้าไปพบมันติดอยู่บนเกาะเล็กใกล้สะพานที่พัง เขาตัดไม้ ซ่อมทางข้าม และพาหมาป่ากลับบ้านด้วยกันก่อนพระอาทิตย์ตก เรื่องสั้นแนวตั้ง 9:16 จบในตอน โทนสดใส ไม่มีบทพูด ไม่มีผู้บรรยาย ใช้ดนตรี บรรยากาศ และเสียงเอฟเฟกต์เล่าเรื่อง\n\nหมาป่าหายไปอีกฝั่งแม่น้ำ Steve จะซ่อมสะพานทันเวลากลับบ้านก่อนพระอาทิตย์ตกไหม?\n\n#Minecraft #MinecraftAdventure #MinecraftShorts #GamingShorts #เรื่องสั้น #ผจญภัย #EP01",
    "YOUTUBE_SHORTS": "หมาป่าหายไปอีกฝั่งแม่น้ำ Steve จะซ่อมสะพานทันเวลากลับบ้านก่อนพระอาทิตย์ตกไหม?\n\nSteve เดินทางกับหมาป่าคู่ใจในทุ่งหญ้า แต่หมาป่าวิ่งตามกระต่ายจนหลงไปอีกฝั่งแม่น้ำ Steve ตามรอยเท้าไปพบมันติดอยู่บนเกาะเล็กใกล้สะพานที่พัง เขาตัดไ...\n\n#Minecraft #MinecraftAdventure #MinecraftShorts #GamingShorts #เรื่องสั้น #ผจญภัย #EP01",
    "TIKTOK": "หมาป่าหายไปอีกฝั่งแม่น้ำ Steve จะซ่อมสะพานทันเวลากลับบ้านก่อนพระอาทิตย์ตกไหม?\nSteve เดินทางกับหมาป่าคู่ใจในทุ่งหญ้า แต่หมาป่าวิ่งตามกระต่ายจนหลงไปอีกฝั่งแม่น้ำ Steve ตามรอยเท้าไปพบมันติดอยู่บนเกาะเล็กใกล้สะพานที่พัง เขาตัดไ...\n#Minecraft #MinecraftAdventure #MinecraftShorts #GamingShorts #เรื่องสั้น #ผจญภัย #EP01",
    "FACEBOOK_REELS": "หมาป่าที่หลงทาง\nSteve เดินทางกับหมาป่าคู่ใจในทุ่งหญ้า แต่หมาป่าวิ่งตามกระต่ายจนหลงไปอีกฝั่งแม่น้ำ Steve ตามรอยเท้าไปพบมันติดอยู่บนเกาะเล็กใกล้สะพานที่พัง เขาตัดไ...\n\n#Minecraft #MinecraftAdventure #MinecraftShorts #GamingShorts #เรื่องสั้น #ผจญภัย #EP01"
  },
  "CTA": "ติดตามตอนต่อไป และกดบันทึกไว้ถ้าชอบเรื่องสั้นแนวนี้",
  "CONTENT_WARNING": "ไม่มี",
  "LANGUAGE": "th-TH",
  "ASPECT_RATIO": "9:16",
  "DURATION_TARGET": "80s",
  "STATUS": "STEP6_READY",
  "GITHUB_PATH": "MINECRAFT-ADVENTURES/EP01-The-Lost-Wolf",
  "GITHUB_URL": "https://github.com/nopphakorn001/PRO-V6.8-PP-Movie-Studio-Projects/tree/main/MINECRAFT-ADVENTURES/EP01-The-Lost-Wolf",
  "SOURCE_PROJECT_FILE": "MINECRAFT-ADVENTURES/EP01-The-Lost-Wolf/STEP6.json",
  "OUTPUT_REFERENCES": {
    "VIDEO_FILE": "",
    "THUMBNAIL_FILE": "",
    "SUBTITLE_FILE": "",
    "YOUTUBE_VIDEO_ID": "",
    "YOUTUBE_SHORTS_ID": "",
    "TIKTOK_POST_ID": "",
    "FACEBOOK_REEL_ID": "",
    "PUBLISHED_URLS": {
      "YOUTUBE": "",
      "YOUTUBE_SHORTS": "",
      "TIKTOK": "",
      "FACEBOOK_REELS": ""
    }
  },
  "AUTOMATION_NOTES": {
    "READY_FOR_AUTO_POST": false,
    "CAPTION_REVIEWED": true,
    "RIGHTS_NOTES": "Unofficial fan-made Minecraft project; not affiliated with Mojang or Microsoft."
  },
  "UPDATED_AT": "2026-08-23T00:00:00+07:00"
}
