{
  "SCHEMA_VERSION": "1.0.0",
  "CONTENT_ID": "minecraft-adventures-ep03",
  "SERIES": "Minecraft Adventures — เรื่องสั้นผจญภัยจบในตอน",
  "SERIES_ID": "minecraft-adventures",
  "EPISODE": 3,
  "TITLE_TH": "Allay กับมรกตที่หายไป",
  "TITLE_EN": "Allay and the Lost Emerald",
  "SHORT_DESCRIPTION_TH": "Steve ทำมรกตหล่นหายระหว่างแลกของในหมู่บ้าน เขาใช้ Allay ช่วยค้นหาโดยส่งมรกตอีกเม็ดให้เป็นตัวอย่าง Allay บินตามหาผ่านป่าดอกไม้จนพบมรกตที่ขอบเหวเล็...",
  "LONG_DESCRIPTION_TH": "Minecraft Adventures EP03 — Allay กับมรกตที่หายไป: Steve ทำมรกตหล่นหายระหว่างแลกของในหมู่บ้าน เขาใช้ Allay ช่วยค้นหาโดยส่งมรกตอีกเม็ดให้เป็นตัวอย่าง Allay บินตามหาผ่านป่าดอกไม้จนพบมรกตที่ขอบเหวเล็ก ๆ และนำกลับมาให้ Steve ทันเวลา เรื่องสั้นแนวตั้ง 9:16 จบในตอน โทนสดใส ไม่มีบทพูด ไม่มีผู้บรรยาย ใช้ดนตรี บรรยากาศ และเสียงเอฟเฟกต์เล่าเรื่อง",
  "HOOK": "มรกตหายเข้าไปใน Flower Forest และ Allay คือเบาะแสสำคัญของภารกิจนี้",
  "HASHTAGS": [
    "#Minecraft",
    "#MinecraftAdventure",
    "#MinecraftShorts",
    "#GamingShorts",
    "#เรื่องสั้น",
    "#ผจญภัย",
    "#EP03"
  ],
  "KEYWORDS": [
    "Minecraft",
    "Minecraft Adventures",
    "เรื่องสั้น Minecraft",
    "ผจญภัย",
    "family friendly",
    "vertical video",
    "shorts",
    "Allay กับมรกตที่หายไป",
    "Allay and the Lost Emerald"
  ],
  "TAGS": [
    "Minecraft",
    "Minecraft Adventures",
    "เรื่องสั้น Minecraft",
    "ผจญภัย",
    "family friendly",
    "vertical video",
    "shorts",
    "Allay กับมรกตที่หายไป",
    "Allay and the Lost Emerald"
  ],
  "PLATFORM_CAPTIONS": {
    "YOUTUBE": "Allay กับมรกตที่หายไป\n\nMinecraft Adventures EP03 — Allay กับมรกตที่หายไป: Steve ทำมรกตหล่นหายระหว่างแลกของในหมู่บ้าน เขาใช้ Allay ช่วยค้นหาโดยส่งมรกตอีกเม็ดให้เป็นตัวอย่าง Allay บินตามหาผ่านป่าดอกไม้จนพบมรกตที่ขอบเหวเล็ก ๆ และนำกลับมาให้ Steve ทันเวลา เรื่องสั้นแนวตั้ง 9:16 จบในตอน โทนสดใส ไม่มีบทพูด ไม่มีผู้บรรยาย ใช้ดนตรี บรรยากาศ และเสียงเอฟเฟกต์เล่าเรื่อง\n\nมรกตหายเข้าไปใน Flower Forest และ Allay คือเบาะแสสำคัญของภารกิจนี้\n\n#Minecraft #MinecraftAdventure #MinecraftShorts #GamingShorts #เรื่องสั้น #ผจญภัย #EP03",
    "YOUTUBE_SHORTS": "มรกตหายเข้าไปใน Flower Forest และ Allay คือเบาะแสสำคัญของภารกิจนี้\n\nSteve ทำมรกตหล่นหายระหว่างแลกของในหมู่บ้าน เขาใช้ Allay ช่วยค้นหาโดยส่งมรกตอีกเม็ดให้เป็นตัวอย่าง Allay บินตามหาผ่านป่าดอกไม้จนพบมรกตที่ขอบเหวเล็...\n\n#Minecraft #MinecraftAdventure #MinecraftShorts #GamingShorts #เรื่องสั้น #ผจญภัย #EP03",
    "TIKTOK": "มรกตหายเข้าไปใน Flower Forest และ Allay คือเบาะแสสำคัญของภารกิจนี้\nSteve ทำมรกตหล่นหายระหว่างแลกของในหมู่บ้าน เขาใช้ Allay ช่วยค้นหาโดยส่งมรกตอีกเม็ดให้เป็นตัวอย่าง Allay บินตามหาผ่านป่าดอกไม้จนพบมรกตที่ขอบเหวเล็...\n#Minecraft #MinecraftAdventure #MinecraftShorts #GamingShorts #เรื่องสั้น #ผจญภัย #EP03",
    "FACEBOOK_REELS": "Allay กับมรกตที่หายไป\nSteve ทำมรกตหล่นหายระหว่างแลกของในหมู่บ้าน เขาใช้ Allay ช่วยค้นหาโดยส่งมรกตอีกเม็ดให้เป็นตัวอย่าง Allay บินตามหาผ่านป่าดอกไม้จนพบมรกตที่ขอบเหวเล็...\n\n#Minecraft #MinecraftAdventure #MinecraftShorts #GamingShorts #เรื่องสั้น #ผจญภัย #EP03"
  },
  "CTA": "ติดตามตอนต่อไป และกดบันทึกไว้ถ้าชอบเรื่องสั้นแนวนี้",
  "CONTENT_WARNING": "ไม่มี",
  "LANGUAGE": "th-TH",
  "ASPECT_RATIO": "9:16",
  "DURATION_TARGET": "80s",
  "STATUS": "STEP6_READY",
  "GITHUB_PATH": "MINECRAFT-ADVENTURES/EP03-Allay-and-the-Lost-Emerald",
  "GITHUB_URL": "https://github.com/nopphakorn001/PRO-V6.8-PP-Movie-Studio-Projects/tree/main/MINECRAFT-ADVENTURES/EP03-Allay-and-the-Lost-Emerald",
  "SOURCE_PROJECT_FILE": "MINECRAFT-ADVENTURES/EP03-Allay-and-the-Lost-Emerald/STEP6.json",
  "OUTPUT_REFERENCES": {
    "VIDEO_FILE": "",
    "THUMBNAIL_FILE": "",
    "SUBTITLE_FILE": "",
    "YOUTUBE_VIDEO_ID": "",
    "YOUTUBE_SHORTS_ID": "",
    "TIKTOK_POST_ID": "",
    "FACEBOOK_REEL_ID": "",
    "PUBLISHED_URLS": {
      "YOUTUBE": "",
      "YOUTUBE_SHORTS": "",
      "TIKTOK": "",
      "FACEBOOK_REELS": ""
    }
  },
  "AUTOMATION_NOTES": {
    "READY_FOR_AUTO_POST": false,
    "CAPTION_REVIEWED": true,
    "RIGHTS_NOTES": "Unofficial fan-made Minecraft project; not affiliated with Mojang or Microsoft."
  },
  "UPDATED_AT": "2026-08-23T00:00:00+07:00"
}
