{
  "SCHEMA_VERSION": "1.0.0",
  "CONTENT_ID": "minecraft-adventures-ep10",
  "SERIES": "Minecraft Adventures — เรื่องสั้นผจญภัยจบในตอน",
  "SERIES_ID": "minecraft-adventures",
  "EPISODE": 10,
  "TITLE_TH": "เค้กสำหรับงานเทศกาลหมู่บ้าน",
  "TITLE_EN": "Cake for the Village Festival",
  "SHORT_DESCRIPTION_TH": "Steve และ Alex ทำเค้กสำหรับงานเทศกาลหมู่บ้านและต้องรีบนำไปส่ง พวกเขาเดินทางด้วยเรือและ minecart เจอ Creeper ขวางทางแต่เลือกอ้อมโดยไม่ต่อสู้ ก่อนถ...",
  "LONG_DESCRIPTION_TH": "Minecraft Adventures EP10 — เค้กสำหรับงานเทศกาลหมู่บ้าน: Steve และ Alex ทำเค้กสำหรับงานเทศกาลหมู่บ้านและต้องรีบนำไปส่ง พวกเขาเดินทางด้วยเรือและ minecart เจอ Creeper ขวางทางแต่เลือกอ้อมโดยไม่ต่อสู้ ก่อนถึงหมู่บ้านทันระฆังเย็น วางเค้กกลางงาน และฉลองกับชาวบ้านด้วย fireworks เรื่องสั้นแนวตั้ง 9:16 จบในตอน โทนสดใส ไม่มีบทพูด ไม่มีผู้บรรยาย ใช้ดนตรี บรรยากาศ และเสียงเอฟเฟกต์เล่าเรื่อง",
  "HOOK": "เค้กงานเทศกาลต้องถึงหมู่บ้านให้ทัน ก่อนค่ำคืนนี้จบด้วยพลุไฟ",
  "HASHTAGS": [
    "#Minecraft",
    "#MinecraftAdventure",
    "#MinecraftShorts",
    "#GamingShorts",
    "#เรื่องสั้น",
    "#ผจญภัย",
    "#EP10"
  ],
  "KEYWORDS": [
    "Minecraft",
    "Minecraft Adventures",
    "เรื่องสั้น Minecraft",
    "ผจญภัย",
    "family friendly",
    "vertical video",
    "shorts",
    "เค้กสำหรับงานเทศกาลหมู่บ้าน",
    "Cake for the Village Festival"
  ],
  "TAGS": [
    "Minecraft",
    "Minecraft Adventures",
    "เรื่องสั้น Minecraft",
    "ผจญภัย",
    "family friendly",
    "vertical video",
    "shorts",
    "เค้กสำหรับงานเทศกาลหมู่บ้าน",
    "Cake for the Village Festival"
  ],
  "PLATFORM_CAPTIONS": {
    "YOUTUBE": "เค้กสำหรับงานเทศกาลหมู่บ้าน\n\nMinecraft Adventures EP10 — เค้กสำหรับงานเทศกาลหมู่บ้าน: Steve และ Alex ทำเค้กสำหรับงานเทศกาลหมู่บ้านและต้องรีบนำไปส่ง พวกเขาเดินทางด้วยเรือและ minecart เจอ Creeper ขวางทางแต่เลือกอ้อมโดยไม่ต่อสู้ ก่อนถึงหมู่บ้านทันระฆังเย็น วางเค้กกลางงาน และฉลองกับชาวบ้านด้วย fireworks เรื่องสั้นแนวตั้ง 9:16 จบในตอน โทนสดใส ไม่มีบทพูด ไม่มีผู้บรรยาย ใช้ดนตรี บรรยากาศ และเสียงเอฟเฟกต์เล่าเรื่อง\n\nเค้กงานเทศกาลต้องถึงหมู่บ้านให้ทัน ก่อนค่ำคืนนี้จบด้วยพลุไฟ\n\n#Minecraft #MinecraftAdventure #MinecraftShorts #GamingShorts #เรื่องสั้น #ผจญภัย #EP10",
    "YOUTUBE_SHORTS": "เค้กงานเทศกาลต้องถึงหมู่บ้านให้ทัน ก่อนค่ำคืนนี้จบด้วยพลุไฟ\n\nSteve และ Alex ทำเค้กสำหรับงานเทศกาลหมู่บ้านและต้องรีบนำไปส่ง พวกเขาเดินทางด้วยเรือและ minecart เจอ Creeper ขวางทางแต่เลือกอ้อมโดยไม่ต่อสู้ ก่อนถ...\n\n#Minecraft #MinecraftAdventure #MinecraftShorts #GamingShorts #เรื่องสั้น #ผจญภัย #EP10",
    "TIKTOK": "เค้กงานเทศกาลต้องถึงหมู่บ้านให้ทัน ก่อนค่ำคืนนี้จบด้วยพลุไฟ\nSteve และ Alex ทำเค้กสำหรับงานเทศกาลหมู่บ้านและต้องรีบนำไปส่ง พวกเขาเดินทางด้วยเรือและ minecart เจอ Creeper ขวางทางแต่เลือกอ้อมโดยไม่ต่อสู้ ก่อนถ...\n#Minecraft #MinecraftAdventure #MinecraftShorts #GamingShorts #เรื่องสั้น #ผจญภัย #EP10",
    "FACEBOOK_REELS": "เค้กสำหรับงานเทศกาลหมู่บ้าน\nSteve และ Alex ทำเค้กสำหรับงานเทศกาลหมู่บ้านและต้องรีบนำไปส่ง พวกเขาเดินทางด้วยเรือและ minecart เจอ Creeper ขวางทางแต่เลือกอ้อมโดยไม่ต่อสู้ ก่อนถ...\n\n#Minecraft #MinecraftAdventure #MinecraftShorts #GamingShorts #เรื่องสั้น #ผจญภัย #EP10"
  },
  "CTA": "ติดตามตอนต่อไป และกดบันทึกไว้ถ้าชอบเรื่องสั้นแนวนี้",
  "CONTENT_WARNING": "ไม่มี",
  "LANGUAGE": "th-TH",
  "ASPECT_RATIO": "9:16",
  "DURATION_TARGET": "80s",
  "STATUS": "STEP6_READY",
  "GITHUB_PATH": "MINECRAFT-ADVENTURES/EP10-Cake-for-the-Village-Festival",
  "GITHUB_URL": "https://github.com/nopphakorn001/PRO-V6.8-PP-Movie-Studio-Projects/tree/main/MINECRAFT-ADVENTURES/EP10-Cake-for-the-Village-Festival",
  "SOURCE_PROJECT_FILE": "MINECRAFT-ADVENTURES/EP10-Cake-for-the-Village-Festival/STEP6.json",
  "OUTPUT_REFERENCES": {
    "VIDEO_FILE": "",
    "THUMBNAIL_FILE": "",
    "SUBTITLE_FILE": "",
    "YOUTUBE_VIDEO_ID": "",
    "YOUTUBE_SHORTS_ID": "",
    "TIKTOK_POST_ID": "",
    "FACEBOOK_REEL_ID": "",
    "PUBLISHED_URLS": {
      "YOUTUBE": "",
      "YOUTUBE_SHORTS": "",
      "TIKTOK": "",
      "FACEBOOK_REELS": ""
    }
  },
  "AUTOMATION_NOTES": {
    "READY_FOR_AUTO_POST": false,
    "CAPTION_REVIEWED": true,
    "RIGHTS_NOTES": "Unofficial fan-made Minecraft project; not affiliated with Mojang or Microsoft."
  },
  "UPDATED_AT": "2026-08-23T00:00:00+07:00"
}
