{
  "SCHEMA_VERSION": "1.0.0",
  "CONTENT_ID": "block-tales-ep02",
  "SERIES": "BLOCK TALES",
  "SERIES_ID": "block-tales",
  "EPISODE": 2,
  "TITLE_TH": "หีบที่ขยับเอง",
  "TITLE_EN": "The Chest That Moved",
  "SHORT_DESCRIPTION_TH": "Nox พบหีบเก่าในเหมืองร้างและสังเกตว่ามันขยับเข้ามาใกล้ทุกครั้งที่เขาหันหลัง เขาทดลองทำเครื่องหมายบนพื้นจนแน่ใจว่าหีบขยับเอง เมื่อเปิดหีบกลับพบว่า...",
  "LONG_DESCRIPTION_TH": "BLOCK TALES EP02 — หีบที่ขยับเอง: Nox พบหีบเก่าในเหมืองร้างและสังเกตว่ามันขยับเข้ามาใกล้ทุกครั้งที่เขาหันหลัง เขาทดลองทำเครื่องหมายบนพื้นจนแน่ใจว่าหีบขยับเอง เมื่อเปิดหีบกลับพบว่าไม่มีอะไรอยู่ข้างใน แต่เสียงฝาหีบปิดดังขึ้นจากด้านหลัง และหีบอีกใบกลับมาปิดทางออกของเขา หนังสั้นแนวตั้งสไตล์ voxel/block-world จบในตอน เน้นภาพ เสียงบรรยากาศ และจังหวะลึกลับสำหรับ Shorts/Reels/TikTok",
  "HOOK": "หีบใบหนึ่งขยับเองในเหมืองร้าง และทุกครั้งที่ Nox หันกลับไป มันใกล้กว่าเดิม",
  "HASHTAGS": [
    "#BlockTales",
    "#VoxelStory",
    "#ShortFilm",
    "#MysteryShorts",
    "#เรื่องสั้น",
    "#หนังสั้น",
    "#EP02"
  ],
  "KEYWORDS": [
    "BLOCK TALES",
    "voxel short film",
    "block-world",
    "หนังสั้น",
    "mystery",
    "thriller",
    "vertical video",
    "shorts",
    "หีบที่ขยับเอง",
    "The Chest That Moved"
  ],
  "TAGS": [
    "BLOCK TALES",
    "voxel short film",
    "block-world",
    "หนังสั้น",
    "mystery",
    "thriller",
    "vertical video",
    "shorts",
    "หีบที่ขยับเอง",
    "The Chest That Moved"
  ],
  "PLATFORM_CAPTIONS": {
    "YOUTUBE": "หีบที่ขยับเอง\n\nBLOCK TALES EP02 — หีบที่ขยับเอง: Nox พบหีบเก่าในเหมืองร้างและสังเกตว่ามันขยับเข้ามาใกล้ทุกครั้งที่เขาหันหลัง เขาทดลองทำเครื่องหมายบนพื้นจนแน่ใจว่าหีบขยับเอง เมื่อเปิดหีบกลับพบว่าไม่มีอะไรอยู่ข้างใน แต่เสียงฝาหีบปิดดังขึ้นจากด้านหลัง และหีบอีกใบกลับมาปิดทางออกของเขา หนังสั้นแนวตั้งสไตล์ voxel/block-world จบในตอน เน้นภาพ เสียงบรรยากาศ และจังหวะลึกลับสำหรับ Shorts/Reels/TikTok\n\nหีบใบหนึ่งขยับเองในเหมืองร้าง และทุกครั้งที่ Nox หันกลับไป มันใกล้กว่าเดิม\n\n#BlockTales #VoxelStory #ShortFilm #MysteryShorts #เรื่องสั้น #หนังสั้น #EP02",
    "YOUTUBE_SHORTS": "หีบใบหนึ่งขยับเองในเหมืองร้าง และทุกครั้งที่ Nox หันกลับไป มันใกล้กว่าเดิม\n\nNox พบหีบเก่าในเหมืองร้างและสังเกตว่ามันขยับเข้ามาใกล้ทุกครั้งที่เขาหันหลัง เขาทดลองทำเครื่องหมายบนพื้นจนแน่ใจว่าหีบขยับเอง เมื่อเปิดหีบกลับพบว่า...\n\n#BlockTales #VoxelStory #ShortFilm #MysteryShorts #เรื่องสั้น #หนังสั้น #EP02",
    "TIKTOK": "หีบใบหนึ่งขยับเองในเหมืองร้าง และทุกครั้งที่ Nox หันกลับไป มันใกล้กว่าเดิม\nNox พบหีบเก่าในเหมืองร้างและสังเกตว่ามันขยับเข้ามาใกล้ทุกครั้งที่เขาหันหลัง เขาทดลองทำเครื่องหมายบนพื้นจนแน่ใจว่าหีบขยับเอง เมื่อเปิดหีบกลับพบว่า...\n#BlockTales #VoxelStory #ShortFilm #MysteryShorts #เรื่องสั้น #หนังสั้น #EP02",
    "FACEBOOK_REELS": "หีบที่ขยับเอง\nNox พบหีบเก่าในเหมืองร้างและสังเกตว่ามันขยับเข้ามาใกล้ทุกครั้งที่เขาหันหลัง เขาทดลองทำเครื่องหมายบนพื้นจนแน่ใจว่าหีบขยับเอง เมื่อเปิดหีบกลับพบว่า...\n\n#BlockTales #VoxelStory #ShortFilm #MysteryShorts #เรื่องสั้น #หนังสั้น #EP02"
  },
  "CTA": "ติดตามตอนต่อไป และกดบันทึกไว้ถ้าชอบเรื่องสั้นแนวนี้",
  "CONTENT_WARNING": "มีบรรยากาศลึกลับ/ระทึกเล็กน้อย ไม่มีภาพรุนแรงชัดเจน",
  "LANGUAGE": "th-TH",
  "ASPECT_RATIO": "9:16",
  "DURATION_TARGET": "80s",
  "STATUS": "STEP6_READY",
  "GITHUB_PATH": "BLOCK-TALES/EP02-The-Chest-That-Moved",
  "GITHUB_URL": "https://github.com/nopphakorn001/PRO-V6.8-PP-Movie-Studio-Projects/tree/main/BLOCK-TALES/EP02-The-Chest-That-Moved",
  "SOURCE_PROJECT_FILE": "BLOCK-TALES/EP02-The-Chest-That-Moved/STEP6.json",
  "OUTPUT_REFERENCES": {
    "VIDEO_FILE": "",
    "THUMBNAIL_FILE": "",
    "SUBTITLE_FILE": "",
    "YOUTUBE_VIDEO_ID": "",
    "YOUTUBE_SHORTS_ID": "",
    "TIKTOK_POST_ID": "",
    "FACEBOOK_REEL_ID": "",
    "PUBLISHED_URLS": {
      "YOUTUBE": "",
      "YOUTUBE_SHORTS": "",
      "TIKTOK": "",
      "FACEBOOK_REELS": ""
    }
  },
  "AUTOMATION_NOTES": {
    "READY_FOR_AUTO_POST": false,
    "CAPTION_REVIEWED": true,
    "RIGHTS_NOTES": "Original voxel/block-world story; avoid branded game UI, logos, copied textures, or exact recreation of copyrighted game characters."
  },
  "UPDATED_AT": "2026-08-23T00:00:00+07:00"
}
