{
  "SCHEMA_VERSION": "1.0.0",
  "CONTENT_ID": "block-tales-ep01",
  "SERIES": "BLOCK TALES",
  "SERIES_ID": "block-tales",
  "EPISODE": 1,
  "TITLE_TH": "อย่าขุดบล็อกสุดท้ายนั้น",
  "TITLE_EN": "Don't Mine the Last Block",
  "SHORT_DESCRIPTION_TH": "Nox นักขุดผู้เดินทางลึกเข้าไปในเหมืองร้าง พบป้ายเตือนว่าอย่าขุดบล็อกสุดท้าย เมื่อเขาได้ยินเสียงเคาะสามครั้งจากใต้พื้น ความอยากรู้ทำให้เขาฝ่าฝืนคำ...",
  "LONG_DESCRIPTION_TH": "BLOCK TALES EP01 — อย่าขุดบล็อกสุดท้ายนั้น: Nox นักขุดผู้เดินทางลึกเข้าไปในเหมืองร้าง พบป้ายเตือนว่าอย่าขุดบล็อกสุดท้าย เมื่อเขาได้ยินเสียงเคาะสามครั้งจากใต้พื้น ความอยากรู้ทำให้เขาฝ่าฝืนคำเตือน บล็อกแตกเผยห้องลับที่มีป้ายข้อความว่า หากเขาอ่านข้อความนี้ได้ บางสิ่งก็รู้แล้วว่าเขาอยู่ที่นี่ ทันใดนั้นทางออกถูกปิด และเสียงเคาะสามครั้งดังขึ้นจากด้านหลังของเขา ก่อนภาพตัดเป็นสีดำ หนังสั้นแนวตั้งสไตล์ voxel/block-world จบในตอน เน้นภาพ เสียงบรรยากาศ และจังหวะลึกลับสำหรับ Shorts/Reels/TikTok",
  "HOOK": "เสียงเคาะสามครั้งดังจากใต้บล็อกต้องห้าม และ Nox กำลังจะตัดสินใจผิดครั้งใหญ่",
  "HASHTAGS": [
    "#BlockTales",
    "#VoxelStory",
    "#ShortFilm",
    "#MysteryShorts",
    "#เรื่องสั้น",
    "#หนังสั้น",
    "#EP01"
  ],
  "KEYWORDS": [
    "BLOCK TALES",
    "voxel short film",
    "block-world",
    "หนังสั้น",
    "mystery",
    "thriller",
    "vertical video",
    "shorts",
    "อย่าขุดบล็อกสุดท้ายนั้น",
    "Don't Mine the Last Block"
  ],
  "TAGS": [
    "BLOCK TALES",
    "voxel short film",
    "block-world",
    "หนังสั้น",
    "mystery",
    "thriller",
    "vertical video",
    "shorts",
    "อย่าขุดบล็อกสุดท้ายนั้น",
    "Don't Mine the Last Block"
  ],
  "PLATFORM_CAPTIONS": {
    "YOUTUBE": "อย่าขุดบล็อกสุดท้ายนั้น\n\nBLOCK TALES EP01 — อย่าขุดบล็อกสุดท้ายนั้น: Nox นักขุดผู้เดินทางลึกเข้าไปในเหมืองร้าง พบป้ายเตือนว่าอย่าขุดบล็อกสุดท้าย เมื่อเขาได้ยินเสียงเคาะสามครั้งจากใต้พื้น ความอยากรู้ทำให้เขาฝ่าฝืนคำเตือน บล็อกแตกเผยห้องลับที่มีป้ายข้อความว่า หากเขาอ่านข้อความนี้ได้ บางสิ่งก็รู้แล้วว่าเขาอยู่ที่นี่ ทันใดนั้นทางออกถูกปิด และเสียงเคาะสามครั้งดังขึ้นจากด้านหลังของเขา ก่อนภาพตัดเป็นสีดำ หนังสั้นแนวตั้งสไตล์ voxel/block-world จบในตอน เน้นภาพ เสียงบรรยากาศ และจังหวะลึกลับสำหรับ Shorts/Reels/TikTok\n\nเสียงเคาะสามครั้งดังจากใต้บล็อกต้องห้าม และ Nox กำลังจะตัดสินใจผิดครั้งใหญ่\n\n#BlockTales #VoxelStory #ShortFilm #MysteryShorts #เรื่องสั้น #หนังสั้น #EP01",
    "YOUTUBE_SHORTS": "เสียงเคาะสามครั้งดังจากใต้บล็อกต้องห้าม และ Nox กำลังจะตัดสินใจผิดครั้งใหญ่\n\nNox นักขุดผู้เดินทางลึกเข้าไปในเหมืองร้าง พบป้ายเตือนว่าอย่าขุดบล็อกสุดท้าย เมื่อเขาได้ยินเสียงเคาะสามครั้งจากใต้พื้น ความอยากรู้ทำให้เขาฝ่าฝืนคำ...\n\n#BlockTales #VoxelStory #ShortFilm #MysteryShorts #เรื่องสั้น #หนังสั้น #EP01",
    "TIKTOK": "เสียงเคาะสามครั้งดังจากใต้บล็อกต้องห้าม และ Nox กำลังจะตัดสินใจผิดครั้งใหญ่\nNox นักขุดผู้เดินทางลึกเข้าไปในเหมืองร้าง พบป้ายเตือนว่าอย่าขุดบล็อกสุดท้าย เมื่อเขาได้ยินเสียงเคาะสามครั้งจากใต้พื้น ความอยากรู้ทำให้เขาฝ่าฝืนคำ...\n#BlockTales #VoxelStory #ShortFilm #MysteryShorts #เรื่องสั้น #หนังสั้น #EP01",
    "FACEBOOK_REELS": "อย่าขุดบล็อกสุดท้ายนั้น\nNox นักขุดผู้เดินทางลึกเข้าไปในเหมืองร้าง พบป้ายเตือนว่าอย่าขุดบล็อกสุดท้าย เมื่อเขาได้ยินเสียงเคาะสามครั้งจากใต้พื้น ความอยากรู้ทำให้เขาฝ่าฝืนคำ...\n\n#BlockTales #VoxelStory #ShortFilm #MysteryShorts #เรื่องสั้น #หนังสั้น #EP01"
  },
  "CTA": "ติดตามตอนต่อไป และกดบันทึกไว้ถ้าชอบเรื่องสั้นแนวนี้",
  "CONTENT_WARNING": "มีบรรยากาศลึกลับ/ระทึกเล็กน้อย ไม่มีภาพรุนแรงชัดเจน",
  "LANGUAGE": "th-TH",
  "ASPECT_RATIO": "9:16",
  "DURATION_TARGET": "96s",
  "STATUS": "STEP6_READY",
  "GITHUB_PATH": "BLOCK-TALES/EP01-Dont-Mine-The-Last-Block",
  "GITHUB_URL": "https://github.com/nopphakorn001/PRO-V6.8-PP-Movie-Studio-Projects/tree/main/BLOCK-TALES/EP01-Dont-Mine-The-Last-Block",
  "SOURCE_PROJECT_FILE": "BLOCK-TALES/EP01-Dont-Mine-The-Last-Block/STEP6.json",
  "OUTPUT_REFERENCES": {
    "VIDEO_FILE": "",
    "THUMBNAIL_FILE": "",
    "SUBTITLE_FILE": "",
    "YOUTUBE_VIDEO_ID": "",
    "YOUTUBE_SHORTS_ID": "",
    "TIKTOK_POST_ID": "",
    "FACEBOOK_REEL_ID": "",
    "PUBLISHED_URLS": {
      "YOUTUBE": "",
      "YOUTUBE_SHORTS": "",
      "TIKTOK": "",
      "FACEBOOK_REELS": ""
    }
  },
  "AUTOMATION_NOTES": {
    "READY_FOR_AUTO_POST": false,
    "CAPTION_REVIEWED": true,
    "RIGHTS_NOTES": "Original voxel/block-world story; avoid branded game UI, logos, copied textures, or exact recreation of copyrighted game characters."
  },
  "UPDATED_AT": "2026-08-23T00:00:00+07:00"
}
