{
  "SCHEMA_VERSION": "1.0.0",
  "CONTENT_ID": "minecraft-adventures-ep07",
  "SERIES": "Minecraft Adventures — เรื่องสั้นผจญภัยจบในตอน",
  "SERIES_ID": "minecraft-adventures",
  "EPISODE": 7,
  "TITLE_TH": "เมล็ดพันธุ์ของ Sniffer",
  "TITLE_EN": "The Sniffer's Lost Seed",
  "SHORT_DESCRIPTION_TH": "Steve และ Alex พา Sniffer เดินผ่าน Cherry Grove เมื่อมันได้กลิ่นเมล็ดโบราณและเดินตามไปจนติดแม่น้ำ ทั้งสองช่วยสร้างทางข้าม จากนั้น Sniffer ขุดพบ t...",
  "LONG_DESCRIPTION_TH": "Minecraft Adventures EP07 — เมล็ดพันธุ์ของ Sniffer: Steve และ Alex พา Sniffer เดินผ่าน Cherry Grove เมื่อมันได้กลิ่นเมล็ดโบราณและเดินตามไปจนติดแม่น้ำ ทั้งสองช่วยสร้างทางข้าม จากนั้น Sniffer ขุดพบ torchflower seed ที่เกือบกลิ้งหายลงเนิน ก่อน Alex จะเก็บไว้และปลูกให้มันสำเร็จ เรื่องสั้นแนวตั้ง 9:16 จบในตอน โทนสดใส ไม่มีบทพูด ไม่มีผู้บรรยาย ใช้ดนตรี บรรยากาศ และเสียงเอฟเฟกต์เล่าเรื่อง",
  "HOOK": "Sniffer กำลังตามหา Torchflower Seed และ Steve กับ Alex ต้องช่วยกันก่อนหมดวัน",
  "HASHTAGS": [
    "#Minecraft",
    "#MinecraftAdventure",
    "#MinecraftShorts",
    "#GamingShorts",
    "#เรื่องสั้น",
    "#ผจญภัย",
    "#EP07"
  ],
  "KEYWORDS": [
    "Minecraft",
    "Minecraft Adventures",
    "เรื่องสั้น Minecraft",
    "ผจญภัย",
    "family friendly",
    "vertical video",
    "shorts",
    "เมล็ดพันธุ์ของ Sniffer",
    "The Sniffer's Lost Seed"
  ],
  "TAGS": [
    "Minecraft",
    "Minecraft Adventures",
    "เรื่องสั้น Minecraft",
    "ผจญภัย",
    "family friendly",
    "vertical video",
    "shorts",
    "เมล็ดพันธุ์ของ Sniffer",
    "The Sniffer's Lost Seed"
  ],
  "PLATFORM_CAPTIONS": {
    "YOUTUBE": "เมล็ดพันธุ์ของ Sniffer\n\nMinecraft Adventures EP07 — เมล็ดพันธุ์ของ Sniffer: Steve และ Alex พา Sniffer เดินผ่าน Cherry Grove เมื่อมันได้กลิ่นเมล็ดโบราณและเดินตามไปจนติดแม่น้ำ ทั้งสองช่วยสร้างทางข้าม จากนั้น Sniffer ขุดพบ torchflower seed ที่เกือบกลิ้งหายลงเนิน ก่อน Alex จะเก็บไว้และปลูกให้มันสำเร็จ เรื่องสั้นแนวตั้ง 9:16 จบในตอน โทนสดใส ไม่มีบทพูด ไม่มีผู้บรรยาย ใช้ดนตรี บรรยากาศ และเสียงเอฟเฟกต์เล่าเรื่อง\n\nSniffer กำลังตามหา Torchflower Seed และ Steve กับ Alex ต้องช่วยกันก่อนหมดวัน\n\n#Minecraft #MinecraftAdventure #MinecraftShorts #GamingShorts #เรื่องสั้น #ผจญภัย #EP07",
    "YOUTUBE_SHORTS": "Sniffer กำลังตามหา Torchflower Seed และ Steve กับ Alex ต้องช่วยกันก่อนหมดวัน\n\nSteve และ Alex พา Sniffer เดินผ่าน Cherry Grove เมื่อมันได้กลิ่นเมล็ดโบราณและเดินตามไปจนติดแม่น้ำ ทั้งสองช่วยสร้างทางข้าม จากนั้น Sniffer ขุดพบ t...\n\n#Minecraft #MinecraftAdventure #MinecraftShorts #GamingShorts #เรื่องสั้น #ผจญภัย #EP07",
    "TIKTOK": "Sniffer กำลังตามหา Torchflower Seed และ Steve กับ Alex ต้องช่วยกันก่อนหมดวัน\nSteve และ Alex พา Sniffer เดินผ่าน Cherry Grove เมื่อมันได้กลิ่นเมล็ดโบราณและเดินตามไปจนติดแม่น้ำ ทั้งสองช่วยสร้างทางข้าม จากนั้น Sniffer ขุดพบ t...\n#Minecraft #MinecraftAdventure #MinecraftShorts #GamingShorts #เรื่องสั้น #ผจญภัย #EP07",
    "FACEBOOK_REELS": "เมล็ดพันธุ์ของ Sniffer\nSteve และ Alex พา Sniffer เดินผ่าน Cherry Grove เมื่อมันได้กลิ่นเมล็ดโบราณและเดินตามไปจนติดแม่น้ำ ทั้งสองช่วยสร้างทางข้าม จากนั้น Sniffer ขุดพบ t...\n\n#Minecraft #MinecraftAdventure #MinecraftShorts #GamingShorts #เรื่องสั้น #ผจญภัย #EP07"
  },
  "CTA": "ติดตามตอนต่อไป และกดบันทึกไว้ถ้าชอบเรื่องสั้นแนวนี้",
  "CONTENT_WARNING": "ไม่มี",
  "LANGUAGE": "th-TH",
  "ASPECT_RATIO": "9:16",
  "DURATION_TARGET": "80s",
  "STATUS": "STEP6_READY",
  "GITHUB_PATH": "MINECRAFT-ADVENTURES/EP07-The-Sniffers-Lost-Seed",
  "GITHUB_URL": "https://github.com/nopphakorn001/PRO-V6.8-PP-Movie-Studio-Projects/tree/main/MINECRAFT-ADVENTURES/EP07-The-Sniffers-Lost-Seed",
  "SOURCE_PROJECT_FILE": "MINECRAFT-ADVENTURES/EP07-The-Sniffers-Lost-Seed/STEP6.json",
  "OUTPUT_REFERENCES": {
    "VIDEO_FILE": "",
    "THUMBNAIL_FILE": "",
    "SUBTITLE_FILE": "",
    "YOUTUBE_VIDEO_ID": "",
    "YOUTUBE_SHORTS_ID": "",
    "TIKTOK_POST_ID": "",
    "FACEBOOK_REEL_ID": "",
    "PUBLISHED_URLS": {
      "YOUTUBE": "",
      "YOUTUBE_SHORTS": "",
      "TIKTOK": "",
      "FACEBOOK_REELS": ""
    }
  },
  "AUTOMATION_NOTES": {
    "READY_FOR_AUTO_POST": false,
    "CAPTION_REVIEWED": true,
    "RIGHTS_NOTES": "Unofficial fan-made Minecraft project; not affiliated with Mojang or Microsoft."
  },
  "UPDATED_AT": "2026-08-23T00:00:00+07:00"
}
