{
  "SCHEMA_VERSION": "1.0.0",
  "CONTENT_ID": "minecraft-adventures-ep05",
  "SERIES": "Minecraft Adventures — เรื่องสั้นผจญภัยจบในตอน",
  "SERIES_ID": "minecraft-adventures",
  "EPISODE": 5,
  "TITLE_TH": "เพชรใต้ถ้ำเขียว",
  "TITLE_EN": "Diamond Beneath the Lush Cave",
  "SHORT_DESCRIPTION_TH": "Steve พบต้น azalea และตามลงไปเจอ Lush Cave ที่สวยงาม เขาพบ axolotl และเห็น diamond ore อยู่อีกฝั่งของสระ จึงสร้างทางข้าม เก็บเพชร แล้วหาทางออกตาม...",
  "LONG_DESCRIPTION_TH": "Minecraft Adventures EP05 — เพชรใต้ถ้ำเขียว: Steve พบต้น azalea และตามลงไปเจอ Lush Cave ที่สวยงาม เขาพบ axolotl และเห็น diamond ore อยู่อีกฝั่งของสระ จึงสร้างทางข้าม เก็บเพชร แล้วหาทางออกตามน้ำตกกลับสู่พื้นดิน ก่อนปล่อย axolotl ลงในบ่อน้ำใกล้บ้าน เรื่องสั้นแนวตั้ง 9:16 จบในตอน โทนสดใส ไม่มีบทพูด ไม่มีผู้บรรยาย ใช้ดนตรี บรรยากาศ และเสียงเอฟเฟกต์เล่าเรื่อง",
  "HOOK": "Steve ลงถ้ำเขียวเพื่อหาเพชร แต่ Axolotl ตัวเล็กอาจพาเขาไปเจอคำตอบ",
  "HASHTAGS": [
    "#Minecraft",
    "#MinecraftAdventure",
    "#MinecraftShorts",
    "#GamingShorts",
    "#เรื่องสั้น",
    "#ผจญภัย",
    "#EP05"
  ],
  "KEYWORDS": [
    "Minecraft",
    "Minecraft Adventures",
    "เรื่องสั้น Minecraft",
    "ผจญภัย",
    "family friendly",
    "vertical video",
    "shorts",
    "เพชรใต้ถ้ำเขียว",
    "Diamond Beneath the Lush Cave"
  ],
  "TAGS": [
    "Minecraft",
    "Minecraft Adventures",
    "เรื่องสั้น Minecraft",
    "ผจญภัย",
    "family friendly",
    "vertical video",
    "shorts",
    "เพชรใต้ถ้ำเขียว",
    "Diamond Beneath the Lush Cave"
  ],
  "PLATFORM_CAPTIONS": {
    "YOUTUBE": "เพชรใต้ถ้ำเขียว\n\nMinecraft Adventures EP05 — เพชรใต้ถ้ำเขียว: Steve พบต้น azalea และตามลงไปเจอ Lush Cave ที่สวยงาม เขาพบ axolotl และเห็น diamond ore อยู่อีกฝั่งของสระ จึงสร้างทางข้าม เก็บเพชร แล้วหาทางออกตามน้ำตกกลับสู่พื้นดิน ก่อนปล่อย axolotl ลงในบ่อน้ำใกล้บ้าน เรื่องสั้นแนวตั้ง 9:16 จบในตอน โทนสดใส ไม่มีบทพูด ไม่มีผู้บรรยาย ใช้ดนตรี บรรยากาศ และเสียงเอฟเฟกต์เล่าเรื่อง\n\nSteve ลงถ้ำเขียวเพื่อหาเพชร แต่ Axolotl ตัวเล็กอาจพาเขาไปเจอคำตอบ\n\n#Minecraft #MinecraftAdventure #MinecraftShorts #GamingShorts #เรื่องสั้น #ผจญภัย #EP05",
    "YOUTUBE_SHORTS": "Steve ลงถ้ำเขียวเพื่อหาเพชร แต่ Axolotl ตัวเล็กอาจพาเขาไปเจอคำตอบ\n\nSteve พบต้น azalea และตามลงไปเจอ Lush Cave ที่สวยงาม เขาพบ axolotl และเห็น diamond ore อยู่อีกฝั่งของสระ จึงสร้างทางข้าม เก็บเพชร แล้วหาทางออกตาม...\n\n#Minecraft #MinecraftAdventure #MinecraftShorts #GamingShorts #เรื่องสั้น #ผจญภัย #EP05",
    "TIKTOK": "Steve ลงถ้ำเขียวเพื่อหาเพชร แต่ Axolotl ตัวเล็กอาจพาเขาไปเจอคำตอบ\nSteve พบต้น azalea และตามลงไปเจอ Lush Cave ที่สวยงาม เขาพบ axolotl และเห็น diamond ore อยู่อีกฝั่งของสระ จึงสร้างทางข้าม เก็บเพชร แล้วหาทางออกตาม...\n#Minecraft #MinecraftAdventure #MinecraftShorts #GamingShorts #เรื่องสั้น #ผจญภัย #EP05",
    "FACEBOOK_REELS": "เพชรใต้ถ้ำเขียว\nSteve พบต้น azalea และตามลงไปเจอ Lush Cave ที่สวยงาม เขาพบ axolotl และเห็น diamond ore อยู่อีกฝั่งของสระ จึงสร้างทางข้าม เก็บเพชร แล้วหาทางออกตาม...\n\n#Minecraft #MinecraftAdventure #MinecraftShorts #GamingShorts #เรื่องสั้น #ผจญภัย #EP05"
  },
  "CTA": "ติดตามตอนต่อไป และกดบันทึกไว้ถ้าชอบเรื่องสั้นแนวนี้",
  "CONTENT_WARNING": "ไม่มี",
  "LANGUAGE": "th-TH",
  "ASPECT_RATIO": "9:16",
  "DURATION_TARGET": "80s",
  "STATUS": "STEP6_READY",
  "GITHUB_PATH": "MINECRAFT-ADVENTURES/EP05-Diamond-Beneath-the-Lush-Cave",
  "GITHUB_URL": "https://github.com/nopphakorn001/PRO-V6.8-PP-Movie-Studio-Projects/tree/main/MINECRAFT-ADVENTURES/EP05-Diamond-Beneath-the-Lush-Cave",
  "SOURCE_PROJECT_FILE": "MINECRAFT-ADVENTURES/EP05-Diamond-Beneath-the-Lush-Cave/STEP6.json",
  "OUTPUT_REFERENCES": {
    "VIDEO_FILE": "",
    "THUMBNAIL_FILE": "",
    "SUBTITLE_FILE": "",
    "YOUTUBE_VIDEO_ID": "",
    "YOUTUBE_SHORTS_ID": "",
    "TIKTOK_POST_ID": "",
    "FACEBOOK_REEL_ID": "",
    "PUBLISHED_URLS": {
      "YOUTUBE": "",
      "YOUTUBE_SHORTS": "",
      "TIKTOK": "",
      "FACEBOOK_REELS": ""
    }
  },
  "AUTOMATION_NOTES": {
    "READY_FOR_AUTO_POST": false,
    "CAPTION_REVIEWED": true,
    "RIGHTS_NOTES": "Unofficial fan-made Minecraft project; not affiliated with Mojang or Microsoft."
  },
  "UPDATED_AT": "2026-08-23T00:00:00+07:00"
}
