{
  "SCHEMA_VERSION": "1.0.0",
  "CONTENT_ID": "minecraft-adventures-ep08",
  "SERIES": "Minecraft Adventures — เรื่องสั้นผจญภัยจบในตอน",
  "SERIES_ID": "minecraft-adventures",
  "EPISODE": 8,
  "TITLE_TH": "รถรางเหมืองหลุดราง",
  "TITLE_EN": "Runaway Minecart",
  "SHORT_DESCRIPTION_TH": "Steve และ Alex สำรวจรางรถเหมืองบนภูเขา แต่ Alex เผลอถูก powered rail ส่งรถวิ่งลงเนิน Steve กระโดดขึ้นรถอีกคันตามไป ทั้งคู่ผ่านอุโมงค์และสวิตช์ราง...",
  "LONG_DESCRIPTION_TH": "Minecraft Adventures EP08 — รถรางเหมืองหลุดราง: Steve และ Alex สำรวจรางรถเหมืองบนภูเขา แต่ Alex เผลอถูก powered rail ส่งรถวิ่งลงเนิน Steve กระโดดขึ้นรถอีกคันตามไป ทั้งคู่ผ่านอุโมงค์และสวิตช์รางที่ต้องแก้ทันเวลา ก่อนออกสู่ทุ่งบนภูเขาและหยุดอย่างปลอดภัยที่กอง hay bale เรื่องสั้นแนวตั้ง 9:16 จบในตอน โทนสดใส ไม่มีบทพูด ไม่มีผู้บรรยาย ใช้ดนตรี บรรยากาศ และเสียงเอฟเฟกต์เล่าเรื่อง",
  "HOOK": "Minecart หลุดรางกลางภูเขา Steve กับ Alex ต้องแก้รางให้ทันก่อนรถพุ่งต่อ",
  "HASHTAGS": [
    "#Minecraft",
    "#MinecraftAdventure",
    "#MinecraftShorts",
    "#GamingShorts",
    "#เรื่องสั้น",
    "#ผจญภัย",
    "#EP08"
  ],
  "KEYWORDS": [
    "Minecraft",
    "Minecraft Adventures",
    "เรื่องสั้น Minecraft",
    "ผจญภัย",
    "family friendly",
    "vertical video",
    "shorts",
    "รถรางเหมืองหลุดราง",
    "Runaway Minecart"
  ],
  "TAGS": [
    "Minecraft",
    "Minecraft Adventures",
    "เรื่องสั้น Minecraft",
    "ผจญภัย",
    "family friendly",
    "vertical video",
    "shorts",
    "รถรางเหมืองหลุดราง",
    "Runaway Minecart"
  ],
  "PLATFORM_CAPTIONS": {
    "YOUTUBE": "รถรางเหมืองหลุดราง\n\nMinecraft Adventures EP08 — รถรางเหมืองหลุดราง: Steve และ Alex สำรวจรางรถเหมืองบนภูเขา แต่ Alex เผลอถูก powered rail ส่งรถวิ่งลงเนิน Steve กระโดดขึ้นรถอีกคันตามไป ทั้งคู่ผ่านอุโมงค์และสวิตช์รางที่ต้องแก้ทันเวลา ก่อนออกสู่ทุ่งบนภูเขาและหยุดอย่างปลอดภัยที่กอง hay bale เรื่องสั้นแนวตั้ง 9:16 จบในตอน โทนสดใส ไม่มีบทพูด ไม่มีผู้บรรยาย ใช้ดนตรี บรรยากาศ และเสียงเอฟเฟกต์เล่าเรื่อง\n\nMinecart หลุดรางกลางภูเขา Steve กับ Alex ต้องแก้รางให้ทันก่อนรถพุ่งต่อ\n\n#Minecraft #MinecraftAdventure #MinecraftShorts #GamingShorts #เรื่องสั้น #ผจญภัย #EP08",
    "YOUTUBE_SHORTS": "Minecart หลุดรางกลางภูเขา Steve กับ Alex ต้องแก้รางให้ทันก่อนรถพุ่งต่อ\n\nSteve และ Alex สำรวจรางรถเหมืองบนภูเขา แต่ Alex เผลอถูก powered rail ส่งรถวิ่งลงเนิน Steve กระโดดขึ้นรถอีกคันตามไป ทั้งคู่ผ่านอุโมงค์และสวิตช์ราง...\n\n#Minecraft #MinecraftAdventure #MinecraftShorts #GamingShorts #เรื่องสั้น #ผจญภัย #EP08",
    "TIKTOK": "Minecart หลุดรางกลางภูเขา Steve กับ Alex ต้องแก้รางให้ทันก่อนรถพุ่งต่อ\nSteve และ Alex สำรวจรางรถเหมืองบนภูเขา แต่ Alex เผลอถูก powered rail ส่งรถวิ่งลงเนิน Steve กระโดดขึ้นรถอีกคันตามไป ทั้งคู่ผ่านอุโมงค์และสวิตช์ราง...\n#Minecraft #MinecraftAdventure #MinecraftShorts #GamingShorts #เรื่องสั้น #ผจญภัย #EP08",
    "FACEBOOK_REELS": "รถรางเหมืองหลุดราง\nSteve และ Alex สำรวจรางรถเหมืองบนภูเขา แต่ Alex เผลอถูก powered rail ส่งรถวิ่งลงเนิน Steve กระโดดขึ้นรถอีกคันตามไป ทั้งคู่ผ่านอุโมงค์และสวิตช์ราง...\n\n#Minecraft #MinecraftAdventure #MinecraftShorts #GamingShorts #เรื่องสั้น #ผจญภัย #EP08"
  },
  "CTA": "ติดตามตอนต่อไป และกดบันทึกไว้ถ้าชอบเรื่องสั้นแนวนี้",
  "CONTENT_WARNING": "ไม่มี",
  "LANGUAGE": "th-TH",
  "ASPECT_RATIO": "9:16",
  "DURATION_TARGET": "80s",
  "STATUS": "STEP6_READY",
  "GITHUB_PATH": "MINECRAFT-ADVENTURES/EP08-Runaway-Minecart",
  "GITHUB_URL": "https://github.com/nopphakorn001/PRO-V6.8-PP-Movie-Studio-Projects/tree/main/MINECRAFT-ADVENTURES/EP08-Runaway-Minecart",
  "SOURCE_PROJECT_FILE": "MINECRAFT-ADVENTURES/EP08-Runaway-Minecart/STEP6.json",
  "OUTPUT_REFERENCES": {
    "VIDEO_FILE": "",
    "THUMBNAIL_FILE": "",
    "SUBTITLE_FILE": "",
    "YOUTUBE_VIDEO_ID": "",
    "YOUTUBE_SHORTS_ID": "",
    "TIKTOK_POST_ID": "",
    "FACEBOOK_REEL_ID": "",
    "PUBLISHED_URLS": {
      "YOUTUBE": "",
      "YOUTUBE_SHORTS": "",
      "TIKTOK": "",
      "FACEBOOK_REELS": ""
    }
  },
  "AUTOMATION_NOTES": {
    "READY_FOR_AUTO_POST": false,
    "CAPTION_REVIEWED": true,
    "RIGHTS_NOTES": "Unofficial fan-made Minecraft project; not affiliated with Mojang or Microsoft."
  },
  "UPDATED_AT": "2026-08-23T00:00:00+07:00"
}
