{
  "SCHEMA_VERSION": "1.0.0",
  "CONTENT_ID": "block-tales-ep04",
  "SERIES": "BLOCK TALES",
  "SERIES_ID": "block-tales",
  "EPISODE": 4,
  "TITLE_TH": "สะพานที่หายไปทีละบล็อก",
  "TITLE_EN": "The Disappearing Bridge",
  "SHORT_DESCRIPTION_TH": "Nox ข้ามสะพานบล็อกแคบเหนือเหวลึก แต่ทุกก้าวทำให้บล็อกด้านหลังร่วงหาย เขาจึงต้องเดินต่อโดยย้อนกลับไม่ได้ เมื่อเจอช่องว่างสุดท้ายเขากระโดดเกาะขอบแล...",
  "LONG_DESCRIPTION_TH": "BLOCK TALES EP04 — สะพานที่หายไปทีละบล็อก: Nox ข้ามสะพานบล็อกแคบเหนือเหวลึก แต่ทุกก้าวทำให้บล็อกด้านหลังร่วงหาย เขาจึงต้องเดินต่อโดยย้อนกลับไม่ได้ เมื่อเจอช่องว่างสุดท้ายเขากระโดดเกาะขอบและปีนขึ้นฝั่งได้สำเร็จ ก่อนพบว่าสะพานทั้งหมดหายไป และบล็อกก้อนแรกกลับปรากฏขึ้นอีกครั้งราวกับกำลังรอคนต่อไป หนังสั้นแนวตั้งสไตล์ voxel/block-world จบในตอน เน้นภาพ เสียงบรรยากาศ และจังหวะลึกลับสำหรับ Shorts/Reels/TikTok",
  "HOOK": "สะพานค่อย ๆ หายไปทีละบล็อก ขณะที่ Nox ยังอยู่กลางทาง",
  "HASHTAGS": [
    "#BlockTales",
    "#VoxelStory",
    "#ShortFilm",
    "#MysteryShorts",
    "#เรื่องสั้น",
    "#หนังสั้น",
    "#EP04"
  ],
  "KEYWORDS": [
    "BLOCK TALES",
    "voxel short film",
    "block-world",
    "หนังสั้น",
    "mystery",
    "thriller",
    "vertical video",
    "shorts",
    "สะพานที่หายไปทีละบล็อก",
    "The Disappearing Bridge"
  ],
  "TAGS": [
    "BLOCK TALES",
    "voxel short film",
    "block-world",
    "หนังสั้น",
    "mystery",
    "thriller",
    "vertical video",
    "shorts",
    "สะพานที่หายไปทีละบล็อก",
    "The Disappearing Bridge"
  ],
  "PLATFORM_CAPTIONS": {
    "YOUTUBE": "สะพานที่หายไปทีละบล็อก\n\nBLOCK TALES EP04 — สะพานที่หายไปทีละบล็อก: Nox ข้ามสะพานบล็อกแคบเหนือเหวลึก แต่ทุกก้าวทำให้บล็อกด้านหลังร่วงหาย เขาจึงต้องเดินต่อโดยย้อนกลับไม่ได้ เมื่อเจอช่องว่างสุดท้ายเขากระโดดเกาะขอบและปีนขึ้นฝั่งได้สำเร็จ ก่อนพบว่าสะพานทั้งหมดหายไป และบล็อกก้อนแรกกลับปรากฏขึ้นอีกครั้งราวกับกำลังรอคนต่อไป หนังสั้นแนวตั้งสไตล์ voxel/block-world จบในตอน เน้นภาพ เสียงบรรยากาศ และจังหวะลึกลับสำหรับ Shorts/Reels/TikTok\n\nสะพานค่อย ๆ หายไปทีละบล็อก ขณะที่ Nox ยังอยู่กลางทาง\n\n#BlockTales #VoxelStory #ShortFilm #MysteryShorts #เรื่องสั้น #หนังสั้น #EP04",
    "YOUTUBE_SHORTS": "สะพานค่อย ๆ หายไปทีละบล็อก ขณะที่ Nox ยังอยู่กลางทาง\n\nNox ข้ามสะพานบล็อกแคบเหนือเหวลึก แต่ทุกก้าวทำให้บล็อกด้านหลังร่วงหาย เขาจึงต้องเดินต่อโดยย้อนกลับไม่ได้ เมื่อเจอช่องว่างสุดท้ายเขากระโดดเกาะขอบแล...\n\n#BlockTales #VoxelStory #ShortFilm #MysteryShorts #เรื่องสั้น #หนังสั้น #EP04",
    "TIKTOK": "สะพานค่อย ๆ หายไปทีละบล็อก ขณะที่ Nox ยังอยู่กลางทาง\nNox ข้ามสะพานบล็อกแคบเหนือเหวลึก แต่ทุกก้าวทำให้บล็อกด้านหลังร่วงหาย เขาจึงต้องเดินต่อโดยย้อนกลับไม่ได้ เมื่อเจอช่องว่างสุดท้ายเขากระโดดเกาะขอบแล...\n#BlockTales #VoxelStory #ShortFilm #MysteryShorts #เรื่องสั้น #หนังสั้น #EP04",
    "FACEBOOK_REELS": "สะพานที่หายไปทีละบล็อก\nNox ข้ามสะพานบล็อกแคบเหนือเหวลึก แต่ทุกก้าวทำให้บล็อกด้านหลังร่วงหาย เขาจึงต้องเดินต่อโดยย้อนกลับไม่ได้ เมื่อเจอช่องว่างสุดท้ายเขากระโดดเกาะขอบแล...\n\n#BlockTales #VoxelStory #ShortFilm #MysteryShorts #เรื่องสั้น #หนังสั้น #EP04"
  },
  "CTA": "ติดตามตอนต่อไป และกดบันทึกไว้ถ้าชอบเรื่องสั้นแนวนี้",
  "CONTENT_WARNING": "มีบรรยากาศลึกลับ/ระทึกเล็กน้อย ไม่มีภาพรุนแรงชัดเจน",
  "LANGUAGE": "th-TH",
  "ASPECT_RATIO": "9:16",
  "DURATION_TARGET": "80s",
  "STATUS": "STEP6_READY",
  "GITHUB_PATH": "BLOCK-TALES/EP04-The-Disappearing-Bridge",
  "GITHUB_URL": "https://github.com/nopphakorn001/PRO-V6.8-PP-Movie-Studio-Projects/tree/main/BLOCK-TALES/EP04-The-Disappearing-Bridge",
  "SOURCE_PROJECT_FILE": "BLOCK-TALES/EP04-The-Disappearing-Bridge/STEP6.json",
  "OUTPUT_REFERENCES": {
    "VIDEO_FILE": "",
    "THUMBNAIL_FILE": "",
    "SUBTITLE_FILE": "",
    "YOUTUBE_VIDEO_ID": "",
    "YOUTUBE_SHORTS_ID": "",
    "TIKTOK_POST_ID": "",
    "FACEBOOK_REEL_ID": "",
    "PUBLISHED_URLS": {
      "YOUTUBE": "",
      "YOUTUBE_SHORTS": "",
      "TIKTOK": "",
      "FACEBOOK_REELS": ""
    }
  },
  "AUTOMATION_NOTES": {
    "READY_FOR_AUTO_POST": false,
    "CAPTION_REVIEWED": true,
    "RIGHTS_NOTES": "Original voxel/block-world story; avoid branded game UI, logos, copied textures, or exact recreation of copyrighted game characters."
  },
  "UPDATED_AT": "2026-08-23T00:00:00+07:00"
}
