{
  "SCHEMA_VERSION": "1.0.0",
  "CONTENT_ID": "minecraft-adventures-ep02",
  "SERIES": "Minecraft Adventures — เรื่องสั้นผจญภัยจบในตอน",
  "SERIES_ID": "minecraft-adventures",
  "EPISODE": 2,
  "TITLE_TH": "สะพานของหมู่บ้าน",
  "TITLE_EN": "The Village Bridge",
  "SHORT_DESCRIPTION_TH": "Alex มาถึงหมู่บ้านและพบว่าสะพานไม้ข้ามลำธารพัง ชาวบ้านขนผลผลิตข้ามไม่ได้ เธอรวบรวมไม้ สร้างแผ่นไม้ และซ่อมสะพาน โดยมี Iron Golem ช่วยวางคานชิ้นสุ...",
  "LONG_DESCRIPTION_TH": "Minecraft Adventures EP02 — สะพานของหมู่บ้าน: Alex มาถึงหมู่บ้านและพบว่าสะพานไม้ข้ามลำธารพัง ชาวบ้านขนผลผลิตข้ามไม่ได้ เธอรวบรวมไม้ สร้างแผ่นไม้ และซ่อมสะพาน โดยมี Iron Golem ช่วยวางคานชิ้นสุดท้าย ก่อนทุกคนข้ามได้อย่างปลอดภัย เรื่องสั้นแนวตั้ง 9:16 จบในตอน โทนสดใส ไม่มีบทพูด ไม่มีผู้บรรยาย ใช้ดนตรี บรรยากาศ และเสียงเอฟเฟกต์เล่าเรื่อง",
  "HOOK": "สะพานหมู่บ้านพัง แต่ Alex, ชาวบ้าน และ Iron Golem จะช่วยกันเปิดทางกลับมาได้ไหม?",
  "HASHTAGS": [
    "#Minecraft",
    "#MinecraftAdventure",
    "#MinecraftShorts",
    "#GamingShorts",
    "#เรื่องสั้น",
    "#ผจญภัย",
    "#EP02"
  ],
  "KEYWORDS": [
    "Minecraft",
    "Minecraft Adventures",
    "เรื่องสั้น Minecraft",
    "ผจญภัย",
    "family friendly",
    "vertical video",
    "shorts",
    "สะพานของหมู่บ้าน",
    "The Village Bridge"
  ],
  "TAGS": [
    "Minecraft",
    "Minecraft Adventures",
    "เรื่องสั้น Minecraft",
    "ผจญภัย",
    "family friendly",
    "vertical video",
    "shorts",
    "สะพานของหมู่บ้าน",
    "The Village Bridge"
  ],
  "PLATFORM_CAPTIONS": {
    "YOUTUBE": "สะพานของหมู่บ้าน\n\nMinecraft Adventures EP02 — สะพานของหมู่บ้าน: Alex มาถึงหมู่บ้านและพบว่าสะพานไม้ข้ามลำธารพัง ชาวบ้านขนผลผลิตข้ามไม่ได้ เธอรวบรวมไม้ สร้างแผ่นไม้ และซ่อมสะพาน โดยมี Iron Golem ช่วยวางคานชิ้นสุดท้าย ก่อนทุกคนข้ามได้อย่างปลอดภัย เรื่องสั้นแนวตั้ง 9:16 จบในตอน โทนสดใส ไม่มีบทพูด ไม่มีผู้บรรยาย ใช้ดนตรี บรรยากาศ และเสียงเอฟเฟกต์เล่าเรื่อง\n\nสะพานหมู่บ้านพัง แต่ Alex, ชาวบ้าน และ Iron Golem จะช่วยกันเปิดทางกลับมาได้ไหม?\n\n#Minecraft #MinecraftAdventure #MinecraftShorts #GamingShorts #เรื่องสั้น #ผจญภัย #EP02",
    "YOUTUBE_SHORTS": "สะพานหมู่บ้านพัง แต่ Alex, ชาวบ้าน และ Iron Golem จะช่วยกันเปิดทางกลับมาได้ไหม?\n\nAlex มาถึงหมู่บ้านและพบว่าสะพานไม้ข้ามลำธารพัง ชาวบ้านขนผลผลิตข้ามไม่ได้ เธอรวบรวมไม้ สร้างแผ่นไม้ และซ่อมสะพาน โดยมี Iron Golem ช่วยวางคานชิ้นสุ...\n\n#Minecraft #MinecraftAdventure #MinecraftShorts #GamingShorts #เรื่องสั้น #ผจญภัย #EP02",
    "TIKTOK": "สะพานหมู่บ้านพัง แต่ Alex, ชาวบ้าน และ Iron Golem จะช่วยกันเปิดทางกลับมาได้ไหม?\nAlex มาถึงหมู่บ้านและพบว่าสะพานไม้ข้ามลำธารพัง ชาวบ้านขนผลผลิตข้ามไม่ได้ เธอรวบรวมไม้ สร้างแผ่นไม้ และซ่อมสะพาน โดยมี Iron Golem ช่วยวางคานชิ้นสุ...\n#Minecraft #MinecraftAdventure #MinecraftShorts #GamingShorts #เรื่องสั้น #ผจญภัย #EP02",
    "FACEBOOK_REELS": "สะพานของหมู่บ้าน\nAlex มาถึงหมู่บ้านและพบว่าสะพานไม้ข้ามลำธารพัง ชาวบ้านขนผลผลิตข้ามไม่ได้ เธอรวบรวมไม้ สร้างแผ่นไม้ และซ่อมสะพาน โดยมี Iron Golem ช่วยวางคานชิ้นสุ...\n\n#Minecraft #MinecraftAdventure #MinecraftShorts #GamingShorts #เรื่องสั้น #ผจญภัย #EP02"
  },
  "CTA": "ติดตามตอนต่อไป และกดบันทึกไว้ถ้าชอบเรื่องสั้นแนวนี้",
  "CONTENT_WARNING": "ไม่มี",
  "LANGUAGE": "th-TH",
  "ASPECT_RATIO": "9:16",
  "DURATION_TARGET": "80s",
  "STATUS": "STEP6_READY",
  "GITHUB_PATH": "MINECRAFT-ADVENTURES/EP02-The-Village-Bridge",
  "GITHUB_URL": "https://github.com/nopphakorn001/PRO-V6.8-PP-Movie-Studio-Projects/tree/main/MINECRAFT-ADVENTURES/EP02-The-Village-Bridge",
  "SOURCE_PROJECT_FILE": "MINECRAFT-ADVENTURES/EP02-The-Village-Bridge/STEP6.json",
  "OUTPUT_REFERENCES": {
    "VIDEO_FILE": "",
    "THUMBNAIL_FILE": "",
    "SUBTITLE_FILE": "",
    "YOUTUBE_VIDEO_ID": "",
    "YOUTUBE_SHORTS_ID": "",
    "TIKTOK_POST_ID": "",
    "FACEBOOK_REEL_ID": "",
    "PUBLISHED_URLS": {
      "YOUTUBE": "",
      "YOUTUBE_SHORTS": "",
      "TIKTOK": "",
      "FACEBOOK_REELS": ""
    }
  },
  "AUTOMATION_NOTES": {
    "READY_FOR_AUTO_POST": false,
    "CAPTION_REVIEWED": true,
    "RIGHTS_NOTES": "Unofficial fan-made Minecraft project; not affiliated with Mojang or Microsoft."
  },
  "UPDATED_AT": "2026-08-23T00:00:00+07:00"
}
