{
  "SCHEMA_VERSION": "1.0.0",
  "CONTENT_ID": "minecraft-adventures-ep09",
  "SERIES": "Minecraft Adventures — เรื่องสั้นผจญภัยจบในตอน",
  "SERIES_ID": "minecraft-adventures",
  "EPISODE": 9,
  "TITLE_TH": "ช่วยรังผึ้งก่อนเย็น",
  "TITLE_EN": "Save the Bees",
  "SHORT_DESCRIPTION_TH": "Alex พบฝูงผึ้งบินวนรอบรังที่หลุดจากต้นไม้ เธอรวบรวมไม้และ honeycomb สร้าง beehive ใหม่ วาง campfire อย่างปลอดภัยใต้รังเพื่อจัดการผึ้ง แล้วติดรังใ...",
  "LONG_DESCRIPTION_TH": "Minecraft Adventures EP09 — ช่วยรังผึ้งก่อนเย็น: Alex พบฝูงผึ้งบินวนรอบรังที่หลุดจากต้นไม้ เธอรวบรวมไม้และ honeycomb สร้าง beehive ใหม่ วาง campfire อย่างปลอดภัยใต้รังเพื่อจัดการผึ้ง แล้วติดรังใหม่บนต้นโอ๊ก ก่อนปลูกดอกไม้เพิ่มและเห็นผึ้งกลับเข้าบ้านใหม่อย่างสงบ เรื่องสั้นแนวตั้ง 9:16 จบในตอน โทนสดใส ไม่มีบทพูด ไม่มีผู้บรรยาย ใช้ดนตรี บรรยากาศ และเสียงเอฟเฟกต์เล่าเรื่อง",
  "HOOK": "รังผึ้งเสียหายก่อนเย็น Alex ต้องสร้างบ้านใหม่ให้ผึ้งกลับมาอย่างปลอดภัย",
  "HASHTAGS": [
    "#Minecraft",
    "#MinecraftAdventure",
    "#MinecraftShorts",
    "#GamingShorts",
    "#เรื่องสั้น",
    "#ผจญภัย",
    "#EP09"
  ],
  "KEYWORDS": [
    "Minecraft",
    "Minecraft Adventures",
    "เรื่องสั้น Minecraft",
    "ผจญภัย",
    "family friendly",
    "vertical video",
    "shorts",
    "ช่วยรังผึ้งก่อนเย็น",
    "Save the Bees"
  ],
  "TAGS": [
    "Minecraft",
    "Minecraft Adventures",
    "เรื่องสั้น Minecraft",
    "ผจญภัย",
    "family friendly",
    "vertical video",
    "shorts",
    "ช่วยรังผึ้งก่อนเย็น",
    "Save the Bees"
  ],
  "PLATFORM_CAPTIONS": {
    "YOUTUBE": "ช่วยรังผึ้งก่อนเย็น\n\nMinecraft Adventures EP09 — ช่วยรังผึ้งก่อนเย็น: Alex พบฝูงผึ้งบินวนรอบรังที่หลุดจากต้นไม้ เธอรวบรวมไม้และ honeycomb สร้าง beehive ใหม่ วาง campfire อย่างปลอดภัยใต้รังเพื่อจัดการผึ้ง แล้วติดรังใหม่บนต้นโอ๊ก ก่อนปลูกดอกไม้เพิ่มและเห็นผึ้งกลับเข้าบ้านใหม่อย่างสงบ เรื่องสั้นแนวตั้ง 9:16 จบในตอน โทนสดใส ไม่มีบทพูด ไม่มีผู้บรรยาย ใช้ดนตรี บรรยากาศ และเสียงเอฟเฟกต์เล่าเรื่อง\n\nรังผึ้งเสียหายก่อนเย็น Alex ต้องสร้างบ้านใหม่ให้ผึ้งกลับมาอย่างปลอดภัย\n\n#Minecraft #MinecraftAdventure #MinecraftShorts #GamingShorts #เรื่องสั้น #ผจญภัย #EP09",
    "YOUTUBE_SHORTS": "รังผึ้งเสียหายก่อนเย็น Alex ต้องสร้างบ้านใหม่ให้ผึ้งกลับมาอย่างปลอดภัย\n\nAlex พบฝูงผึ้งบินวนรอบรังที่หลุดจากต้นไม้ เธอรวบรวมไม้และ honeycomb สร้าง beehive ใหม่ วาง campfire อย่างปลอดภัยใต้รังเพื่อจัดการผึ้ง แล้วติดรังใ...\n\n#Minecraft #MinecraftAdventure #MinecraftShorts #GamingShorts #เรื่องสั้น #ผจญภัย #EP09",
    "TIKTOK": "รังผึ้งเสียหายก่อนเย็น Alex ต้องสร้างบ้านใหม่ให้ผึ้งกลับมาอย่างปลอดภัย\nAlex พบฝูงผึ้งบินวนรอบรังที่หลุดจากต้นไม้ เธอรวบรวมไม้และ honeycomb สร้าง beehive ใหม่ วาง campfire อย่างปลอดภัยใต้รังเพื่อจัดการผึ้ง แล้วติดรังใ...\n#Minecraft #MinecraftAdventure #MinecraftShorts #GamingShorts #เรื่องสั้น #ผจญภัย #EP09",
    "FACEBOOK_REELS": "ช่วยรังผึ้งก่อนเย็น\nAlex พบฝูงผึ้งบินวนรอบรังที่หลุดจากต้นไม้ เธอรวบรวมไม้และ honeycomb สร้าง beehive ใหม่ วาง campfire อย่างปลอดภัยใต้รังเพื่อจัดการผึ้ง แล้วติดรังใ...\n\n#Minecraft #MinecraftAdventure #MinecraftShorts #GamingShorts #เรื่องสั้น #ผจญภัย #EP09"
  },
  "CTA": "ติดตามตอนต่อไป และกดบันทึกไว้ถ้าชอบเรื่องสั้นแนวนี้",
  "CONTENT_WARNING": "ไม่มี",
  "LANGUAGE": "th-TH",
  "ASPECT_RATIO": "9:16",
  "DURATION_TARGET": "80s",
  "STATUS": "STEP6_READY",
  "GITHUB_PATH": "MINECRAFT-ADVENTURES/EP09-Save-the-Bees",
  "GITHUB_URL": "https://github.com/nopphakorn001/PRO-V6.8-PP-Movie-Studio-Projects/tree/main/MINECRAFT-ADVENTURES/EP09-Save-the-Bees",
  "SOURCE_PROJECT_FILE": "MINECRAFT-ADVENTURES/EP09-Save-the-Bees/STEP6.json",
  "OUTPUT_REFERENCES": {
    "VIDEO_FILE": "",
    "THUMBNAIL_FILE": "",
    "SUBTITLE_FILE": "",
    "YOUTUBE_VIDEO_ID": "",
    "YOUTUBE_SHORTS_ID": "",
    "TIKTOK_POST_ID": "",
    "FACEBOOK_REEL_ID": "",
    "PUBLISHED_URLS": {
      "YOUTUBE": "",
      "YOUTUBE_SHORTS": "",
      "TIKTOK": "",
      "FACEBOOK_REELS": ""
    }
  },
  "AUTOMATION_NOTES": {
    "READY_FOR_AUTO_POST": false,
    "CAPTION_REVIEWED": true,
    "RIGHTS_NOTES": "Unofficial fan-made Minecraft project; not affiliated with Mojang or Microsoft."
  },
  "UPDATED_AT": "2026-08-23T00:00:00+07:00"
}
