{
  "SCHEMA_VERSION": "1.0.0",
  "CONTENT_ID": "block-tales-ep03",
  "SERIES": "BLOCK TALES",
  "SERIES_ID": "block-tales",
  "EPISODE": 3,
  "TITLE_TH": "คบเพลิงอันสุดท้าย",
  "TITLE_EN": "One Torch Left",
  "SHORT_DESCRIPTION_TH": "Nox เหลือคบเพลิงเพียงอันเดียวในถ้ำลึก ทุกครั้งที่แสงอ่อนลงจะมีเสียงฝีเท้าตามหลัง เมื่อเขาวางคบเพลิงอันสุดท้ายที่ทางตัน เสียงทุกอย่างเงียบลง แต่คบ...",
  "LONG_DESCRIPTION_TH": "BLOCK TALES EP03 — คบเพลิงอันสุดท้าย: Nox เหลือคบเพลิงเพียงอันเดียวในถ้ำลึก ทุกครั้งที่แสงอ่อนลงจะมีเสียงฝีเท้าตามหลัง เมื่อเขาวางคบเพลิงอันสุดท้ายที่ทางตัน เสียงทุกอย่างเงียบลง แต่คบเพลิงกลับดับ และคบเพลิงอีกอันติดขึ้นเองจากด้านหลังทั้งที่เขาไม่มีเหลือแล้ว หนังสั้นแนวตั้งสไตล์ voxel/block-world จบในตอน เน้นภาพ เสียงบรรยากาศ และจังหวะลึกลับสำหรับ Shorts/Reels/TikTok",
  "HOOK": "คบเพลิงเหลืออันสุดท้ายในทางมืด และ Nox ต้องเลือกว่าจะเดินต่อหรือย้อนกลับ",
  "HASHTAGS": [
    "#BlockTales",
    "#VoxelStory",
    "#ShortFilm",
    "#MysteryShorts",
    "#เรื่องสั้น",
    "#หนังสั้น",
    "#EP03"
  ],
  "KEYWORDS": [
    "BLOCK TALES",
    "voxel short film",
    "block-world",
    "หนังสั้น",
    "mystery",
    "thriller",
    "vertical video",
    "shorts",
    "คบเพลิงอันสุดท้าย",
    "One Torch Left"
  ],
  "TAGS": [
    "BLOCK TALES",
    "voxel short film",
    "block-world",
    "หนังสั้น",
    "mystery",
    "thriller",
    "vertical video",
    "shorts",
    "คบเพลิงอันสุดท้าย",
    "One Torch Left"
  ],
  "PLATFORM_CAPTIONS": {
    "YOUTUBE": "คบเพลิงอันสุดท้าย\n\nBLOCK TALES EP03 — คบเพลิงอันสุดท้าย: Nox เหลือคบเพลิงเพียงอันเดียวในถ้ำลึก ทุกครั้งที่แสงอ่อนลงจะมีเสียงฝีเท้าตามหลัง เมื่อเขาวางคบเพลิงอันสุดท้ายที่ทางตัน เสียงทุกอย่างเงียบลง แต่คบเพลิงกลับดับ และคบเพลิงอีกอันติดขึ้นเองจากด้านหลังทั้งที่เขาไม่มีเหลือแล้ว หนังสั้นแนวตั้งสไตล์ voxel/block-world จบในตอน เน้นภาพ เสียงบรรยากาศ และจังหวะลึกลับสำหรับ Shorts/Reels/TikTok\n\nคบเพลิงเหลืออันสุดท้ายในทางมืด และ Nox ต้องเลือกว่าจะเดินต่อหรือย้อนกลับ\n\n#BlockTales #VoxelStory #ShortFilm #MysteryShorts #เรื่องสั้น #หนังสั้น #EP03",
    "YOUTUBE_SHORTS": "คบเพลิงเหลืออันสุดท้ายในทางมืด และ Nox ต้องเลือกว่าจะเดินต่อหรือย้อนกลับ\n\nNox เหลือคบเพลิงเพียงอันเดียวในถ้ำลึก ทุกครั้งที่แสงอ่อนลงจะมีเสียงฝีเท้าตามหลัง เมื่อเขาวางคบเพลิงอันสุดท้ายที่ทางตัน เสียงทุกอย่างเงียบลง แต่คบ...\n\n#BlockTales #VoxelStory #ShortFilm #MysteryShorts #เรื่องสั้น #หนังสั้น #EP03",
    "TIKTOK": "คบเพลิงเหลืออันสุดท้ายในทางมืด และ Nox ต้องเลือกว่าจะเดินต่อหรือย้อนกลับ\nNox เหลือคบเพลิงเพียงอันเดียวในถ้ำลึก ทุกครั้งที่แสงอ่อนลงจะมีเสียงฝีเท้าตามหลัง เมื่อเขาวางคบเพลิงอันสุดท้ายที่ทางตัน เสียงทุกอย่างเงียบลง แต่คบ...\n#BlockTales #VoxelStory #ShortFilm #MysteryShorts #เรื่องสั้น #หนังสั้น #EP03",
    "FACEBOOK_REELS": "คบเพลิงอันสุดท้าย\nNox เหลือคบเพลิงเพียงอันเดียวในถ้ำลึก ทุกครั้งที่แสงอ่อนลงจะมีเสียงฝีเท้าตามหลัง เมื่อเขาวางคบเพลิงอันสุดท้ายที่ทางตัน เสียงทุกอย่างเงียบลง แต่คบ...\n\n#BlockTales #VoxelStory #ShortFilm #MysteryShorts #เรื่องสั้น #หนังสั้น #EP03"
  },
  "CTA": "ติดตามตอนต่อไป และกดบันทึกไว้ถ้าชอบเรื่องสั้นแนวนี้",
  "CONTENT_WARNING": "มีบรรยากาศลึกลับ/ระทึกเล็กน้อย ไม่มีภาพรุนแรงชัดเจน",
  "LANGUAGE": "th-TH",
  "ASPECT_RATIO": "9:16",
  "DURATION_TARGET": "80s",
  "STATUS": "STEP6_READY",
  "GITHUB_PATH": "BLOCK-TALES/EP03-One-Torch-Left",
  "GITHUB_URL": "https://github.com/nopphakorn001/PRO-V6.8-PP-Movie-Studio-Projects/tree/main/BLOCK-TALES/EP03-One-Torch-Left",
  "SOURCE_PROJECT_FILE": "BLOCK-TALES/EP03-One-Torch-Left/STEP6.json",
  "OUTPUT_REFERENCES": {
    "VIDEO_FILE": "LOCAL_OUTPUTS/KID/block-tales/EP03/master.mp4",
    "THUMBNAIL_FILE": "",
    "SUBTITLE_FILE": "",
    "YOUTUBE_VIDEO_ID": "swEBRZ_UPQs",
    "YOUTUBE_SHORTS_ID": "swEBRZ_UPQs",
    "TIKTOK_POST_ID": "",
    "FACEBOOK_REEL_ID": "",
    "PUBLISHED_URLS": {
      "YOUTUBE": "https://youtu.be/swEBRZ_UPQs",
      "YOUTUBE_SHORTS": "https://youtu.be/swEBRZ_UPQs",
      "TIKTOK": "",
      "FACEBOOK_REELS": ""
    },
    "SHORT_VIDEO_FILE": "LOCAL_OUTPUTS/KID/block-tales/EP03/master.mp4"
  },
  "AUTOMATION_NOTES": {
    "READY_FOR_AUTO_POST": true,
    "CAPTION_REVIEWED": true,
    "RIGHTS_NOTES": "Original voxel/block-world story; avoid branded game UI, logos, copied textures, or exact recreation of copyrighted game characters.",
    "AUTO_POST_STATUS": "PUBLISHED",
    "APPROVED_BY": "owner",
    "APPROVED_AT": "2026-08-24T10:09:11.019394Z",
    "LAST_AUTO_POST_UPDATE": "2026-08-24T10:36:12.119332Z"
  },
  "UPDATED_AT": "2026-08-24T10:36:12.119332Z"
}
