{
  "SCHEMA_VERSION": "1.0.0",
  "CONTENT_ID": "block-tales-ep06",
  "SERIES": "BLOCK TALES",
  "SERIES_ID": "block-tales",
  "EPISODE": 6,
  "TITLE_TH": "ประตูที่ไม่มีอยู่เมื่อครู่",
  "TITLE_EN": "The Door That Wasn't There",
  "SHORT_DESCRIPTION_TH": "Nox กลับมาที่ที่พักใต้ดินและพบประตูไม้บนกำแพงที่เดิมไม่มีประตู เขาเปิดเข้าไปเจอทางเดินสั้นและประตูอีกบาน เมื่อผ่านประตูที่สองกลับมาถึงห้องเดิม แต...",
  "LONG_DESCRIPTION_TH": "BLOCK TALES EP06 — ประตูที่ไม่มีอยู่เมื่อครู่: Nox กลับมาที่ที่พักใต้ดินและพบประตูไม้บนกำแพงที่เดิมไม่มีประตู เขาเปิดเข้าไปเจอทางเดินสั้นและประตูอีกบาน เมื่อผ่านประตูที่สองกลับมาถึงห้องเดิม แต่คราวนี้เห็นตัวเองอีกคนกำลังเปิดประตูเข้ามาจากอีกฝั่ง ก่อนแสงทั้งหมดดับลง หนังสั้นแนวตั้งสไตล์ voxel/block-world จบในตอน เน้นภาพ เสียงบรรยากาศ และจังหวะลึกลับสำหรับ Shorts/Reels/TikTok",
  "HOOK": "ประตูที่ไม่เคยอยู่ตรงนั้นเพิ่งปรากฏขึ้น และ Nox รู้ว่ามันกำลังรอให้เปิด",
  "HASHTAGS": [
    "#BlockTales",
    "#VoxelStory",
    "#ShortFilm",
    "#MysteryShorts",
    "#เรื่องสั้น",
    "#หนังสั้น",
    "#EP06"
  ],
  "KEYWORDS": [
    "BLOCK TALES",
    "voxel short film",
    "block-world",
    "หนังสั้น",
    "mystery",
    "thriller",
    "vertical video",
    "shorts",
    "ประตูที่ไม่มีอยู่เมื่อครู่",
    "The Door That Wasn't There"
  ],
  "TAGS": [
    "BLOCK TALES",
    "voxel short film",
    "block-world",
    "หนังสั้น",
    "mystery",
    "thriller",
    "vertical video",
    "shorts",
    "ประตูที่ไม่มีอยู่เมื่อครู่",
    "The Door That Wasn't There"
  ],
  "PLATFORM_CAPTIONS": {
    "YOUTUBE": "ประตูที่ไม่มีอยู่เมื่อครู่\n\nBLOCK TALES EP06 — ประตูที่ไม่มีอยู่เมื่อครู่: Nox กลับมาที่ที่พักใต้ดินและพบประตูไม้บนกำแพงที่เดิมไม่มีประตู เขาเปิดเข้าไปเจอทางเดินสั้นและประตูอีกบาน เมื่อผ่านประตูที่สองกลับมาถึงห้องเดิม แต่คราวนี้เห็นตัวเองอีกคนกำลังเปิดประตูเข้ามาจากอีกฝั่ง ก่อนแสงทั้งหมดดับลง หนังสั้นแนวตั้งสไตล์ voxel/block-world จบในตอน เน้นภาพ เสียงบรรยากาศ และจังหวะลึกลับสำหรับ Shorts/Reels/TikTok\n\nประตูที่ไม่เคยอยู่ตรงนั้นเพิ่งปรากฏขึ้น และ Nox รู้ว่ามันกำลังรอให้เปิด\n\n#BlockTales #VoxelStory #ShortFilm #MysteryShorts #เรื่องสั้น #หนังสั้น #EP06",
    "YOUTUBE_SHORTS": "ประตูที่ไม่เคยอยู่ตรงนั้นเพิ่งปรากฏขึ้น และ Nox รู้ว่ามันกำลังรอให้เปิด\n\nNox กลับมาที่ที่พักใต้ดินและพบประตูไม้บนกำแพงที่เดิมไม่มีประตู เขาเปิดเข้าไปเจอทางเดินสั้นและประตูอีกบาน เมื่อผ่านประตูที่สองกลับมาถึงห้องเดิม แต...\n\n#BlockTales #VoxelStory #ShortFilm #MysteryShorts #เรื่องสั้น #หนังสั้น #EP06",
    "TIKTOK": "ประตูที่ไม่เคยอยู่ตรงนั้นเพิ่งปรากฏขึ้น และ Nox รู้ว่ามันกำลังรอให้เปิด\nNox กลับมาที่ที่พักใต้ดินและพบประตูไม้บนกำแพงที่เดิมไม่มีประตู เขาเปิดเข้าไปเจอทางเดินสั้นและประตูอีกบาน เมื่อผ่านประตูที่สองกลับมาถึงห้องเดิม แต...\n#BlockTales #VoxelStory #ShortFilm #MysteryShorts #เรื่องสั้น #หนังสั้น #EP06",
    "FACEBOOK_REELS": "ประตูที่ไม่มีอยู่เมื่อครู่\nNox กลับมาที่ที่พักใต้ดินและพบประตูไม้บนกำแพงที่เดิมไม่มีประตู เขาเปิดเข้าไปเจอทางเดินสั้นและประตูอีกบาน เมื่อผ่านประตูที่สองกลับมาถึงห้องเดิม แต...\n\n#BlockTales #VoxelStory #ShortFilm #MysteryShorts #เรื่องสั้น #หนังสั้น #EP06"
  },
  "CTA": "ติดตามตอนต่อไป และกดบันทึกไว้ถ้าชอบเรื่องสั้นแนวนี้",
  "CONTENT_WARNING": "มีบรรยากาศลึกลับ/ระทึกเล็กน้อย ไม่มีภาพรุนแรงชัดเจน",
  "LANGUAGE": "th-TH",
  "ASPECT_RATIO": "9:16",
  "DURATION_TARGET": "80s",
  "STATUS": "STEP6_READY",
  "GITHUB_PATH": "BLOCK-TALES/EP06-The-Door-That-Wasnt-There",
  "GITHUB_URL": "https://github.com/nopphakorn001/PRO-V6.8-PP-Movie-Studio-Projects/tree/main/BLOCK-TALES/EP06-The-Door-That-Wasnt-There",
  "SOURCE_PROJECT_FILE": "BLOCK-TALES/EP06-The-Door-That-Wasnt-There/STEP6.json",
  "OUTPUT_REFERENCES": {
    "VIDEO_FILE": "",
    "THUMBNAIL_FILE": "",
    "SUBTITLE_FILE": "",
    "YOUTUBE_VIDEO_ID": "",
    "YOUTUBE_SHORTS_ID": "",
    "TIKTOK_POST_ID": "",
    "FACEBOOK_REEL_ID": "",
    "PUBLISHED_URLS": {
      "YOUTUBE": "",
      "YOUTUBE_SHORTS": "",
      "TIKTOK": "",
      "FACEBOOK_REELS": ""
    }
  },
  "AUTOMATION_NOTES": {
    "READY_FOR_AUTO_POST": false,
    "CAPTION_REVIEWED": true,
    "RIGHTS_NOTES": "Original voxel/block-world story; avoid branded game UI, logos, copied textures, or exact recreation of copyrighted game characters."
  },
  "UPDATED_AT": "2026-08-23T00:00:00+07:00"
}
