{
  "SCHEMA_VERSION": "1.0.0",
  "CONTENT_ID": "roblox-brothers-adventure-ep02",
  "SERIES": "Roblox Brothers Adventure — 2 พี่น้องตะลุยโลกเกม",
  "SERIES_ID": "roblox-brothers-adventure",
  "EPISODE": 2,
  "TITLE_TH": "รถรางเหมืองสุดป่วน",
  "TITLE_EN": "Minecart Adventure",
  "SHORT_DESCRIPTION_TH": "Roblox Brothers Adventure — 2 พี่น้องตะลุยโลกเกม EP02: MAX และ MINI ตะลุยด่าน Minecart Adventure แบบจบในตอน โทนสดใส ไม่ dark ไม่มีบทพูด เน้น music + ambience + SFX และ visual storytelling",
  "LONG_DESCRIPTION_TH": "Roblox Brothers Adventure — 2 พี่น้องตะลุยโลกเกม EP02: MAX และ MINI ตะลุยด่าน Minecart Adventure แบบจบในตอน โทนสดใส ไม่ dark ไม่มีบทพูด เน้น music + ambience + SFX และ visual storytelling สำหรับวิดีโอแนวตั้ง 9:16 ประมาณ 80 วินาที 10 scenes x 8 วินาที พร้อมข้อมูลสำหรับ YouTube, YouTube Shorts, TikTok และ Facebook Reels",
  "HOOK": "รถรางพุ่งเข้าเหมืองคริสตัล แต่รางข้างหน้าหายไปหนึ่งท่อน",
  "HASHTAGS": [
    "#RobloxStyle",
    "#AdventureShorts",
    "#GamingShorts",
    "#พี่น้อง",
    "#เรื่องสั้น",
    "#ผจญภัย",
    "#EP02"
  ],
  "KEYWORDS": [
    "Roblox-style",
    "2 brothers",
    "พี่น้อง",
    "game avatar",
    "adventure",
    "family friendly",
    "vertical video",
    "รถรางเหมืองสุดป่วน",
    "Minecart Adventure",
    "Minecart Adventure"
  ],
  "TAGS": [
    "Roblox-style",
    "2 brothers",
    "พี่น้อง",
    "game avatar",
    "adventure",
    "family friendly",
    "vertical video",
    "รถรางเหมืองสุดป่วน",
    "Minecart Adventure",
    "Minecart Adventure"
  ],
  "PLATFORM_CAPTIONS": {
    "YOUTUBE": "รถรางเหมืองสุดป่วน\n\nRoblox Brothers Adventure — 2 พี่น้องตะลุยโลกเกม EP02: MAX และ MINI ตะลุยด่าน Minecart Adventure แบบจบในตอน โทนสดใส ไม่ dark ไม่มีบทพูด เน้น music + ambience + SFX และ visual storytelling สำหรับวิดีโอแนวตั้ง 9:16 ประมาณ 80 วินาที 10 scenes x 8 วินาที พร้อมข้อมูลสำหรับ YouTube, YouTube Shorts, TikTok และ Facebook Reels\n\nรถรางพุ่งเข้าเหมืองคริสตัล แต่รางข้างหน้าหายไปหนึ่งท่อน\n\n#RobloxStyle #AdventureShorts #GamingShorts #พี่น้อง #เรื่องสั้น #ผจญภัย #EP02",
    "YOUTUBE_SHORTS": "รถรางพุ่งเข้าเหมืองคริสตัล แต่รางข้างหน้าหายไปหนึ่งท่อน\n\nRoblox Brothers Adventure — 2 พี่น้องตะลุยโลกเกม EP02: MAX และ MINI ตะลุยด่าน Minecart Adventure แบบจบในตอน โทนสดใส ไม่ dark ไม่มีบทพูด เน้น music + ambience + SFX และ visual storytelling\n\n#RobloxStyle #AdventureShorts #GamingShorts #พี่น้อง #เรื่องสั้น #ผจญภัย #EP02",
    "TIKTOK": "รถรางพุ่งเข้าเหมืองคริสตัล แต่รางข้างหน้าหายไปหนึ่งท่อน\nRoblox Brothers Adventure — 2 พี่น้องตะลุยโลกเกม EP02: MAX และ MINI ตะลุยด่าน Minecart Adventure แบบจบในตอน โทนสดใส ไม่ dark ไม่มีบทพูด เน้น music + ambience + SFX และ visual storytelling\n#RobloxStyle #AdventureShorts #GamingShorts #พี่น้อง #เรื่องสั้น #ผจญภัย #EP02",
    "FACEBOOK_REELS": "รถรางเหมืองสุดป่วน\nRoblox Brothers Adventure — 2 พี่น้องตะลุยโลกเกม EP02: MAX และ MINI ตะลุยด่าน Minecart Adventure แบบจบในตอน โทนสดใส ไม่ dark ไม่มีบทพูด เน้น music + ambience + SFX และ visual storytelling\n\n#RobloxStyle #AdventureShorts #GamingShorts #พี่น้อง #เรื่องสั้น #ผจญภัย #EP02"
  },
  "CTA": "ติดตามตอนต่อไปของ 2 พี่น้องตะลุยโลกเกม และกดบันทึกไว้ถ้าชอบเรื่องสั้นแนวผจญภัยสดใส",
  "CONTENT_WARNING": "ไม่มี",
  "LANGUAGE": "th-TH",
  "ASPECT_RATIO": "9:16",
  "DURATION_TARGET": "80s",
  "STATUS": "STEP6_READY",
  "GITHUB_PATH": "ROBLOX-BROTHERS-ADVENTURE/EP02-Minecart-Adventure",
  "GITHUB_URL": "https://github.com/nopphakorn001/PRO-V6.8-PP-Movie-Studio-Projects/tree/main/ROBLOX-BROTHERS-ADVENTURE/EP02-Minecart-Adventure",
  "SOURCE_PROJECT_FILE": "ROBLOX-BROTHERS-ADVENTURE/EP02-Minecart-Adventure/STEP6.json",
  "OUTPUT_REFERENCES": {
    "VIDEO_FILE": "",
    "THUMBNAIL_FILE": "",
    "SUBTITLE_FILE": "",
    "YOUTUBE_VIDEO_ID": "",
    "YOUTUBE_SHORTS_ID": "",
    "TIKTOK_POST_ID": "",
    "FACEBOOK_REEL_ID": "",
    "PUBLISHED_URLS": {
      "YOUTUBE": "",
      "YOUTUBE_SHORTS": "",
      "TIKTOK": "",
      "FACEBOOK_REELS": ""
    }
  },
  "AUTOMATION_NOTES": {
    "READY_FOR_AUTO_POST": false,
    "CAPTION_REVIEWED": true,
    "RIGHTS_NOTES": "Stylized Roblox-style adventure project. No official Roblox logos, UI, copyrighted maps or copied assets. Character designs are stylized game avatars based on reference image only, with no real-person identification."
  },
  "UPDATED_AT": "2026-08-24T09:00:00+07:00"
}
