{
  "SCHEMA_VERSION": "1.0.0",
  "CONTENT_ID": "block-tales-ep05",
  "SERIES": "BLOCK TALES",
  "SERIES_ID": "block-tales",
  "EPISODE": 5,
  "TITLE_TH": "หมู่บ้านที่ไม่มีใครตื่น",
  "TITLE_EN": "The Silent Village",
  "SHORT_DESCRIPTION_TH": "Nox มาถึงหมู่บ้านที่ดูเหมือนมีคนอยู่ ไฟยังติด พืชผลยังสด และประตูเปิด แต่กลับไม่มีใครอยู่เลย ระฆังกลางหมู่บ้านดังขึ้นเอง รอยเท้าทั้งหมดไปจบที่ลาน...",
  "LONG_DESCRIPTION_TH": "BLOCK TALES EP05 — หมู่บ้านที่ไม่มีใครตื่น: Nox มาถึงหมู่บ้านที่ดูเหมือนมีคนอยู่ ไฟยังติด พืชผลยังสด และประตูเปิด แต่กลับไม่มีใครอยู่เลย ระฆังกลางหมู่บ้านดังขึ้นเอง รอยเท้าทั้งหมดไปจบที่ลานกลาง ก่อนประตูทุกบ้านจะปิดพร้อมกัน และทางออกของหมู่บ้านถูกกำแพงปิดกั้นโดยไม่ทราบสาเหตุ หนังสั้นแนวตั้งสไตล์ voxel/block-world จบในตอน เน้นภาพ เสียงบรรยากาศ และจังหวะลึกลับสำหรับ Shorts/Reels/TikTok",
  "HOOK": "หมู่บ้านทั้งหมู่บ้านเงียบสนิท ไม่มีใครตื่น แต่ทุกบ้านเหมือนเพิ่งมีคนอยู่",
  "HASHTAGS": [
    "#BlockTales",
    "#VoxelStory",
    "#ShortFilm",
    "#MysteryShorts",
    "#เรื่องสั้น",
    "#หนังสั้น",
    "#EP05"
  ],
  "KEYWORDS": [
    "BLOCK TALES",
    "voxel short film",
    "block-world",
    "หนังสั้น",
    "mystery",
    "thriller",
    "vertical video",
    "shorts",
    "หมู่บ้านที่ไม่มีใครตื่น",
    "The Silent Village"
  ],
  "TAGS": [
    "BLOCK TALES",
    "voxel short film",
    "block-world",
    "หนังสั้น",
    "mystery",
    "thriller",
    "vertical video",
    "shorts",
    "หมู่บ้านที่ไม่มีใครตื่น",
    "The Silent Village"
  ],
  "PLATFORM_CAPTIONS": {
    "YOUTUBE": "หมู่บ้านที่ไม่มีใครตื่น\n\nBLOCK TALES EP05 — หมู่บ้านที่ไม่มีใครตื่น: Nox มาถึงหมู่บ้านที่ดูเหมือนมีคนอยู่ ไฟยังติด พืชผลยังสด และประตูเปิด แต่กลับไม่มีใครอยู่เลย ระฆังกลางหมู่บ้านดังขึ้นเอง รอยเท้าทั้งหมดไปจบที่ลานกลาง ก่อนประตูทุกบ้านจะปิดพร้อมกัน และทางออกของหมู่บ้านถูกกำแพงปิดกั้นโดยไม่ทราบสาเหตุ หนังสั้นแนวตั้งสไตล์ voxel/block-world จบในตอน เน้นภาพ เสียงบรรยากาศ และจังหวะลึกลับสำหรับ Shorts/Reels/TikTok\n\nหมู่บ้านทั้งหมู่บ้านเงียบสนิท ไม่มีใครตื่น แต่ทุกบ้านเหมือนเพิ่งมีคนอยู่\n\n#BlockTales #VoxelStory #ShortFilm #MysteryShorts #เรื่องสั้น #หนังสั้น #EP05",
    "YOUTUBE_SHORTS": "หมู่บ้านทั้งหมู่บ้านเงียบสนิท ไม่มีใครตื่น แต่ทุกบ้านเหมือนเพิ่งมีคนอยู่\n\nNox มาถึงหมู่บ้านที่ดูเหมือนมีคนอยู่ ไฟยังติด พืชผลยังสด และประตูเปิด แต่กลับไม่มีใครอยู่เลย ระฆังกลางหมู่บ้านดังขึ้นเอง รอยเท้าทั้งหมดไปจบที่ลาน...\n\n#BlockTales #VoxelStory #ShortFilm #MysteryShorts #เรื่องสั้น #หนังสั้น #EP05",
    "TIKTOK": "หมู่บ้านทั้งหมู่บ้านเงียบสนิท ไม่มีใครตื่น แต่ทุกบ้านเหมือนเพิ่งมีคนอยู่\nNox มาถึงหมู่บ้านที่ดูเหมือนมีคนอยู่ ไฟยังติด พืชผลยังสด และประตูเปิด แต่กลับไม่มีใครอยู่เลย ระฆังกลางหมู่บ้านดังขึ้นเอง รอยเท้าทั้งหมดไปจบที่ลาน...\n#BlockTales #VoxelStory #ShortFilm #MysteryShorts #เรื่องสั้น #หนังสั้น #EP05",
    "FACEBOOK_REELS": "หมู่บ้านที่ไม่มีใครตื่น\nNox มาถึงหมู่บ้านที่ดูเหมือนมีคนอยู่ ไฟยังติด พืชผลยังสด และประตูเปิด แต่กลับไม่มีใครอยู่เลย ระฆังกลางหมู่บ้านดังขึ้นเอง รอยเท้าทั้งหมดไปจบที่ลาน...\n\n#BlockTales #VoxelStory #ShortFilm #MysteryShorts #เรื่องสั้น #หนังสั้น #EP05"
  },
  "CTA": "ติดตามตอนต่อไป และกดบันทึกไว้ถ้าชอบเรื่องสั้นแนวนี้",
  "CONTENT_WARNING": "มีบรรยากาศลึกลับ/ระทึกเล็กน้อย ไม่มีภาพรุนแรงชัดเจน",
  "LANGUAGE": "th-TH",
  "ASPECT_RATIO": "9:16",
  "DURATION_TARGET": "80s",
  "STATUS": "STEP6_READY",
  "GITHUB_PATH": "BLOCK-TALES/EP05-The-Silent-Village",
  "GITHUB_URL": "https://github.com/nopphakorn001/PRO-V6.8-PP-Movie-Studio-Projects/tree/main/BLOCK-TALES/EP05-The-Silent-Village",
  "SOURCE_PROJECT_FILE": "BLOCK-TALES/EP05-The-Silent-Village/STEP6.json",
  "OUTPUT_REFERENCES": {
    "VIDEO_FILE": "",
    "THUMBNAIL_FILE": "",
    "SUBTITLE_FILE": "",
    "YOUTUBE_VIDEO_ID": "",
    "YOUTUBE_SHORTS_ID": "",
    "TIKTOK_POST_ID": "",
    "FACEBOOK_REEL_ID": "",
    "PUBLISHED_URLS": {
      "YOUTUBE": "",
      "YOUTUBE_SHORTS": "",
      "TIKTOK": "",
      "FACEBOOK_REELS": ""
    }
  },
  "AUTOMATION_NOTES": {
    "READY_FOR_AUTO_POST": false,
    "CAPTION_REVIEWED": true,
    "RIGHTS_NOTES": "Original voxel/block-world story; avoid branded game UI, logos, copied textures, or exact recreation of copyrighted game characters."
  },
  "UPDATED_AT": "2026-08-23T00:00:00+07:00"
}
